number,value,datetime_start,datetime_complete,duration,params_bootstrap,params_ccp_alpha,params_clip_q,params_criterion,params_max_depth,params_max_features,params_max_samples,params_min_impurity_decrease,params_min_samples_leaf,params_min_samples_split,params_synthetic_weight,system_attrs_tpe:relative_params:0,state
0,47.88776233093796,2026-09-27 17:35:01.923074,2026-09-27 17:35:22.860123,0 days 00:00:20.937049,False,1e-05,0.01,squared_error,40.0,0.35,,0.001,1,7,0.1,,COMPLETE
1,70.56157507727384,2026-09-27 17:35:22.914547,2026-09-27 17:36:13.262871,0 days 00:00:50.348324,False,1e-06,0.001,squared_error,24.0,1.0,,0.001,8,14,0.2,,COMPLETE
2,61.57214928099929,2026-09-27 17:36:13.321185,2026-09-27 17:36:24.291798,0 days 00:00:10.970613,True,0.001,0.01,squared_error,,1.0,0.9210347179474957,0.01,8,13,0.25,,COMPLETE
3,55.19858044389798,2026-09-27 17:36:24.347278,2026-09-27 17:36:28.841940,0 days 00:00:04.494662,False,1e-05,0.005,squared_error,40.0,sqrt,,0.01,9,8,0.2,,COMPLETE
4,50.4423172476906,2026-09-27 17:36:28.898374,2026-09-27 17:36:35.484587,0 days 00:00:06.586213,False,1e-06,0.0005,squared_error,16.0,0.12,,0.0,7,6,0.65,,COMPLETE
5,54.63930363624191,2026-09-27 17:36:35.543912,2026-09-27 17:36:49.805852,0 days 00:00:14.261940,True,0.001,0.01,squared_error,40.0,0.5,0.927424521398035,1e-05,5,20,1.0,,COMPLETE
6,59.942091314168195,2026-09-27 17:36:49.858942,2026-09-27 17:37:05.728342,0 days 00:00:15.869400,True,0.0,0.005,absolute_error,20.0,0.18,0.8568189246324989,0.0001,8,7,0.6,,COMPLETE
7,61.531304320280015,2026-09-27 17:37:05.781997,2026-09-27 17:37:08.126226,0 days 00:00:02.344229,True,0.0,0.001,squared_error,,sqrt,0.6409381782775996,0.01,8,10,0.55,,COMPLETE
8,67.03443948863962,2026-09-27 17:37:08.179440,2026-09-27 17:37:10.334518,0 days 00:00:02.155078,True,0.0001,0.005,squared_error,40.0,sqrt,0.6522833047149669,0.0,7,7,0.15,,COMPLETE
9,69.43601108342084,2026-09-27 17:37:10.387024,2026-09-27 17:37:14.836409,0 days 00:00:04.449385,True,0.0001,0.001,absolute_error,16.0,0.12,0.857270593823643,0.001,9,13,0.1,,COMPLETE
10,63.52488269972955,2026-09-27 17:37:14.889053,2026-09-27 17:37:17.125336,0 days 00:00:02.236283,True,0.0001,0.005,squared_error,,log2,0.9932524439732059,1e-05,9,13,0.4,,COMPLETE
11,48.855573913268636,2026-09-27 17:37:17.179238,2026-09-27 17:37:24.208596,0 days 00:00:07.029358,False,1e-05,0.0,squared_error,20.0,0.12,,0.0001,3,14,0.45,,COMPLETE
12,47.78423640655755,2026-09-27 17:37:24.261393,2026-09-27 17:37:45.243687,0 days 00:00:20.982294,False,1e-05,0.01,squared_error,,0.35,,0.0,2,5,0.1,"{""bootstrap"": false, ""ccp_alpha"": 1e-05, ""clip_q"": 0.01, ""criterion"": ""squared_error"", ""max_depth"": null, ""max_features"": 0.35, ""min_impurity_decrease"": 0.0, ""min_samples_leaf"": 2, ""min_samples_split"": 5, ""synthetic_weight"": 0.1}",COMPLETE
13,70.5471799633724,2026-09-27 17:37:45.298769,2026-09-27 17:38:20.362290,0 days 00:00:35.063521,False,0.0,0.01,squared_error,24.0,1.0,,0.001,1,8,0.1,"{""bootstrap"": false, ""ccp_alpha"": 0.0, ""clip_q"": 0.01, ""criterion"": ""squared_error"", ""max_depth"": 24, ""max_features"": 1.0, ""min_impurity_decrease"": 0.001, ""min_samples_leaf"": 1, ""min_samples_split"": 8, ""synthetic_weight"": 0.1}",PRUNED
14,49.50667042793193,2026-09-27 17:38:20.422167,2026-09-27 17:38:25.547156,0 days 00:00:05.124989,False,1e-05,0.01,squared_error,40.0,0.08,,0.001,5,5,0.55,"{""bootstrap"": false, ""ccp_alpha"": 1e-05, ""clip_q"": 0.01, ""criterion"": ""squared_error"", ""max_depth"": 40, ""max_features"": 0.08, ""min_impurity_decrease"": 0.001, ""min_samples_leaf"": 5, ""min_samples_split"": 5, ""synthetic_weight"": 0.55}",COMPLETE
15,48.551018604543714,2026-09-27 17:38:25.603969,2026-09-27 17:38:44.530764,0 days 00:00:18.926795,False,0.001,0.005,squared_error,,0.35,,0.0,4,6,0.3,"{""bootstrap"": false, ""ccp_alpha"": 0.001, ""clip_q"": 0.005, ""criterion"": ""squared_error"", ""max_depth"": null, ""max_features"": 0.35, ""min_impurity_decrease"": 0.0, ""min_samples_leaf"": 4, ""min_samples_split"": 6, ""synthetic_weight"": 0.3}",COMPLETE
16,50.389419820274604,2026-09-27 17:38:44.584691,2026-09-27 17:38:49.526044,0 days 00:00:04.941353,False,1e-05,0.01,squared_error,16.0,sqrt,,0.0,3,2,0.15,"{""bootstrap"": false, ""ccp_alpha"": 1e-05, ""clip_q"": 0.01, ""criterion"": ""squared_error"", ""max_depth"": 16, ""max_features"": ""sqrt"", ""min_impurity_decrease"": 0.0, ""min_samples_leaf"": 3, ""min_samples_split"": 2, ""synthetic_weight"": 0.15}",COMPLETE
17,47.03168577157097,2026-09-27 17:38:49.579433,2026-09-27 17:39:12.620588,0 days 00:00:23.041155,False,1e-05,0.005,squared_error,40.0,0.35,,0.001,1,2,0.1,"{""bootstrap"": false, ""ccp_alpha"": 1e-05, ""clip_q"": 0.005, ""criterion"": ""squared_error"", ""max_depth"": 40, ""max_features"": 0.35, ""min_impurity_decrease"": 0.001, ""min_samples_leaf"": 1, ""min_samples_split"": 2, ""synthetic_weight"": 0.1}",COMPLETE
18,70.92057781809626,2026-09-27 17:39:12.675348,2026-09-27 17:39:49.040334,0 days 00:00:36.364986,False,1e-05,0.005,squared_error,40.0,1.0,,0.001,2,2,0.95,"{""bootstrap"": false, ""ccp_alpha"": 1e-05, ""clip_q"": 0.005, ""criterion"": ""squared_error"", ""max_depth"": 40, ""max_features"": 1.0, ""min_impurity_decrease"": 0.001, ""min_samples_leaf"": 2, ""min_samples_split"": 2, ""synthetic_weight"": 0.95}",PRUNED
19,63.00692229867489,2026-09-27 17:39:49.099156,2026-09-27 17:39:51.050089,0 days 00:00:01.950933,True,0.0,0.01,absolute_error,,log2,0.7494845984272596,0.0,1,5,0.1,"{""bootstrap"": true, ""ccp_alpha"": 0.0, ""clip_q"": 0.01, ""criterion"": ""absolute_error"", ""max_depth"": null, ""max_features"": ""log2"", ""min_impurity_decrease"": 0.0, ""min_samples_leaf"": 1, ""min_samples_split"": 5, ""synthetic_weight"": 0.1}",PRUNED
20,54.55983332921197,2026-09-27 17:39:51.104096,2026-09-27 17:40:00.126238,0 days 00:00:09.022142,False,1e-05,0.005,squared_error,12.0,0.18,,0.001,4,12,0.1,"{""bootstrap"": false, ""ccp_alpha"": 1e-05, ""clip_q"": 0.005, ""criterion"": ""squared_error"", ""max_depth"": 12, ""max_features"": 0.18, ""min_impurity_decrease"": 0.001, ""min_samples_leaf"": 4, ""min_samples_split"": 12, ""synthetic_weight"": 0.1}",COMPLETE
21,53.705259321076255,2026-09-27 17:40:00.188855,2026-09-27 17:41:41.259001,0 days 00:01:41.070146,False,0.001,0.005,absolute_error,40.0,0.35,,0.01,1,4,0.1,"{""bootstrap"": false, ""ccp_alpha"": 0.001, ""clip_q"": 0.005, ""criterion"": ""absolute_error"", ""max_depth"": 40, ""max_features"": 0.35, ""min_impurity_decrease"": 0.01, ""min_samples_leaf"": 1, ""min_samples_split"": 4, ""synthetic_weight"": 0.1}",COMPLETE
22,54.297890265886465,2026-09-27 17:41:41.318954,2026-09-27 17:42:52.339251,0 days 00:01:11.020297,False,1e-05,0.01,absolute_error,12.0,0.35,,0.0,1,5,0.3,"{""bootstrap"": false, ""ccp_alpha"": 1e-05, ""clip_q"": 0.01, ""criterion"": ""absolute_error"", ""max_depth"": 12, ""max_features"": 0.35, ""min_impurity_decrease"": 0.0, ""min_samples_leaf"": 1, ""min_samples_split"": 5, ""synthetic_weight"": 0.3}",COMPLETE
23,47.33412741725254,2026-09-27 17:42:52.398229,2026-09-27 17:43:12.448862,0 days 00:00:20.050633,False,1e-05,0.001,squared_error,40.0,0.35,,0.001,2,7,0.5,"{""bootstrap"": false, ""ccp_alpha"": 1e-05, ""clip_q"": 0.001, ""criterion"": ""squared_error"", ""max_depth"": 40, ""max_features"": 0.35, ""min_impurity_decrease"": 0.001, ""min_samples_leaf"": 2, ""min_samples_split"": 7, ""synthetic_weight"": 0.5}",COMPLETE
24,46.75426140470806,2026-09-27 17:43:12.501996,2026-09-27 17:43:33.113855,0 days 00:00:20.611859,False,1e-05,0.0005,squared_error,,0.35,,0.0,2,3,0.4,"{""bootstrap"": false, ""ccp_alpha"": 1e-05, ""clip_q"": 0.0005, ""criterion"": ""squared_error"", ""max_depth"": null, ""max_features"": 0.35, ""min_impurity_decrease"": 0.0, ""min_samples_leaf"": 2, ""min_samples_split"": 3, ""synthetic_weight"": 0.4}",COMPLETE
25,53.2240891831843,2026-09-27 17:43:33.168565,2026-09-27 17:43:46.297353,0 days 00:00:13.128788,True,1e-05,0.0005,squared_error,,0.5,0.7398833070929978,0.0,1,2,0.75,"{""bootstrap"": true, ""ccp_alpha"": 1e-05, ""clip_q"": 0.0005, ""criterion"": ""squared_error"", ""max_depth"": null, ""max_features"": 0.5, ""min_impurity_decrease"": 0.0, ""min_samples_leaf"": 1, ""min_samples_split"": 2, ""synthetic_weight"": 0.75}",COMPLETE
26,47.59010892431363,2026-09-27 17:43:46.356495,2026-09-27 17:43:57.829806,0 days 00:00:11.473311,False,0.0001,0.005,squared_error,20.0,0.18,,0.001,1,4,0.1,"{""bootstrap"": false, ""ccp_alpha"": 0.0001, ""clip_q"": 0.005, ""criterion"": ""squared_error"", ""max_depth"": 20, ""max_features"": 0.18, ""min_impurity_decrease"": 0.001, ""min_samples_leaf"": 1, ""min_samples_split"": 4, ""synthetic_weight"": 0.1}",COMPLETE
27,52.136273875475595,2026-09-27 17:43:57.888228,2026-09-27 17:44:02.455600,0 days 00:00:04.567372,False,1e-05,0.0005,squared_error,12.0,sqrt,,0.01,3,5,0.4,"{""bootstrap"": false, ""ccp_alpha"": 1e-05, ""clip_q"": 0.0005, ""criterion"": ""squared_error"", ""max_depth"": 12, ""max_features"": ""sqrt"", ""min_impurity_decrease"": 0.01, ""min_samples_leaf"": 3, ""min_samples_split"": 5, ""synthetic_weight"": 0.4}",COMPLETE
28,48.88513981074232,2026-09-27 17:44:02.514589,2026-09-27 17:44:22.379094,0 days 00:00:19.864505,False,0.0001,0.005,squared_error,40.0,0.35,,1e-05,3,8,0.1,"{""bootstrap"": false, ""ccp_alpha"": 0.0001, ""clip_q"": 0.005, ""criterion"": ""squared_error"", ""max_depth"": 40, ""max_features"": 0.35, ""min_impurity_decrease"": 1e-05, ""min_samples_leaf"": 3, ""min_samples_split"": 8, ""synthetic_weight"": 0.1}",COMPLETE
29,46.61097441467964,2026-09-27 17:44:22.438329,2026-09-27 17:44:45.047568,0 days 00:00:22.609239,False,1e-05,0.0025,squared_error,32.0,0.35,,0.0,1,2,0.4,"{""bootstrap"": false, ""ccp_alpha"": 1e-05, ""clip_q"": 0.0025, ""criterion"": ""squared_error"", ""max_depth"": 32, ""max_features"": 0.35, ""min_impurity_decrease"": 0.0, ""min_samples_leaf"": 1, ""min_samples_split"": 2, ""synthetic_weight"": 0.4}",COMPLETE
30,48.00311797047685,2026-09-27 17:44:45.109143,2026-09-27 17:45:04.059960,0 days 00:00:18.950817,False,0.001,0.0005,squared_error,,0.35,,0.0,4,2,0.4,"{""bootstrap"": false, ""ccp_alpha"": 0.001, ""clip_q"": 0.0005, ""criterion"": ""squared_error"", ""max_depth"": null, ""max_features"": 0.35, ""min_impurity_decrease"": 0.0, ""min_samples_leaf"": 4, ""min_samples_split"": 2, ""synthetic_weight"": 0.4}",COMPLETE
31,46.9579879036271,2026-09-27 17:45:04.120530,2026-09-27 17:45:11.543799,0 days 00:00:07.423269,False,1e-05,0.005,squared_error,16.0,0.12,,0.01,1,5,0.4,"{""bootstrap"": false, ""ccp_alpha"": 1e-05, ""clip_q"": 0.005, ""criterion"": ""squared_error"", ""max_depth"": 16, ""max_features"": 0.12, ""min_impurity_decrease"": 0.01, ""min_samples_leaf"": 1, ""min_samples_split"": 5, ""synthetic_weight"": 0.4}",COMPLETE
32,46.831868460955086,2026-09-27 17:45:11.597301,2026-09-27 17:45:32.228871,0 days 00:00:20.631570,False,1e-05,0.0025,squared_error,32.0,0.35,,0.0,2,2,0.4,"{""bootstrap"": false, ""ccp_alpha"": 1e-05, ""clip_q"": 0.0025, ""criterion"": ""squared_error"", ""max_depth"": 32, ""max_features"": 0.35, ""min_impurity_decrease"": 0.0, ""min_samples_leaf"": 2, ""min_samples_split"": 2, ""synthetic_weight"": 0.4}",COMPLETE
33,51.643720113767884,2026-09-27 17:45:32.282558,2026-09-27 17:46:01.246258,0 days 00:00:28.963700,False,1e-05,0.005,absolute_error,16.0,0.12,,0.01,4,5,0.4,"{""bootstrap"": false, ""ccp_alpha"": 1e-05, ""clip_q"": 0.005, ""criterion"": ""absolute_error"", ""max_depth"": 16, ""max_features"": 0.12, ""min_impurity_decrease"": 0.01, ""min_samples_leaf"": 4, ""min_samples_split"": 5, ""synthetic_weight"": 0.4}",COMPLETE
34,48.24480097490661,2026-09-27 17:46:01.307059,2026-09-27 17:46:30.304900,0 days 00:00:28.997841,False,1e-05,0.0005,squared_error,32.0,0.5,,0.0,1,8,0.4,"{""bootstrap"": false, ""ccp_alpha"": 1e-05, ""clip_q"": 0.0005, ""criterion"": ""squared_error"", ""max_depth"": 32, ""max_features"": 0.5, ""min_impurity_decrease"": 0.0, ""min_samples_leaf"": 1, ""min_samples_split"": 8, ""synthetic_weight"": 0.4}",COMPLETE
35,52.89654392411211,2026-09-27 17:46:30.358088,2026-09-27 17:47:00.385904,0 days 00:00:30.027816,False,1e-05,0.005,absolute_error,16.0,0.12,,0.01,2,5,0.2,"{""bootstrap"": false, ""ccp_alpha"": 1e-05, ""clip_q"": 0.005, ""criterion"": ""absolute_error"", ""max_depth"": 16, ""max_features"": 0.12, ""min_impurity_decrease"": 0.01, ""min_samples_leaf"": 2, ""min_samples_split"": 5, ""synthetic_weight"": 0.2}",COMPLETE
36,55.197582791442706,2026-09-27 17:47:00.444196,2026-09-27 17:47:04.902268,0 days 00:00:04.458072,True,1e-05,0.0025,squared_error,20.0,0.5,0.745818800205302,0.0,4,4,0.4,"{""bootstrap"": true, ""ccp_alpha"": 1e-05, ""clip_q"": 0.0025, ""criterion"": ""squared_error"", ""max_depth"": 20, ""max_features"": 0.5, ""min_impurity_decrease"": 0.0, ""min_samples_leaf"": 4, ""min_samples_split"": 4, ""synthetic_weight"": 0.4}",PRUNED
37,46.64910136603024,2026-09-27 17:47:04.961580,2026-09-27 17:47:10.583175,0 days 00:00:05.621595,False,0.0,0.0025,squared_error,32.0,0.08,,0.001,2,2,0.4,"{""bootstrap"": false, ""ccp_alpha"": 0.0, ""clip_q"": 0.0025, ""criterion"": ""squared_error"", ""max_depth"": 32, ""max_features"": 0.08, ""min_impurity_decrease"": 0.001, ""min_samples_leaf"": 2, ""min_samples_split"": 2, ""synthetic_weight"": 0.4}",COMPLETE
38,46.3565513410702,2026-09-27 17:47:10.637109,2026-09-27 17:47:16.173170,0 days 00:00:05.536061,False,0.0,0.0025,squared_error,32.0,0.08,,1e-05,2,2,0.6,"{""bootstrap"": false, ""ccp_alpha"": 0.0, ""clip_q"": 0.0025, ""criterion"": ""squared_error"", ""max_depth"": 32, ""max_features"": 0.08, ""min_impurity_decrease"": 1e-05, ""min_samples_leaf"": 2, ""min_samples_split"": 2, ""synthetic_weight"": 0.6}",COMPLETE
39,46.74782534097368,2026-09-27 17:47:16.226564,2026-09-27 17:47:21.635342,0 days 00:00:05.408778,False,0.0,0.0025,squared_error,32.0,0.08,,1e-05,2,6,0.6,"{""bootstrap"": false, ""ccp_alpha"": 0.0, ""clip_q"": 0.0025, ""criterion"": ""squared_error"", ""max_depth"": 32, ""max_features"": 0.08, ""min_impurity_decrease"": 1e-05, ""min_samples_leaf"": 2, ""min_samples_split"": 6, ""synthetic_weight"": 0.6}",COMPLETE
40,45.87897632487659,2026-09-27 17:47:21.688534,2026-09-27 17:47:27.758447,0 days 00:00:06.069913,False,0.0,0.0025,squared_error,32.0,0.08,,1e-05,1,2,0.75,"{""bootstrap"": false, ""ccp_alpha"": 0.0, ""clip_q"": 0.0025, ""criterion"": ""squared_error"", ""max_depth"": 32, ""max_features"": 0.08, ""min_impurity_decrease"": 1e-05, ""min_samples_leaf"": 1, ""min_samples_split"": 2, ""synthetic_weight"": 0.75}",COMPLETE
41,46.58059309994559,2026-09-27 17:47:27.813149,2026-09-27 17:47:33.328032,0 days 00:00:05.514883,False,0.0,0.01,squared_error,32.0,0.08,,1e-05,2,3,0.9,"{""bootstrap"": false, ""ccp_alpha"": 0.0, ""clip_q"": 0.01, ""criterion"": ""squared_error"", ""max_depth"": 32, ""max_features"": 0.08, ""min_impurity_decrease"": 1e-05, ""min_samples_leaf"": 2, ""min_samples_split"": 3, ""synthetic_weight"": 0.9}",COMPLETE
42,51.85253520940264,2026-09-27 17:47:33.382251,2026-09-27 17:47:38.780169,0 days 00:00:05.397918,False,0.0,0.0025,squared_error,32.0,0.08,,0.001,3,2,0.05,"{""bootstrap"": false, ""ccp_alpha"": 0.0, ""clip_q"": 0.0025, ""criterion"": ""squared_error"", ""max_depth"": 32, ""max_features"": 0.08, ""min_impurity_decrease"": 0.001, ""min_samples_leaf"": 3, ""min_samples_split"": 2, ""synthetic_weight"": 0.05}",COMPLETE
43,68.31678775698637,2026-09-27 17:47:38.833629,2026-09-27 17:48:19.196639,0 days 00:00:40.363010,False,0.001,0.005,squared_error,32.0,1.0,,1e-05,1,2,0.7,"{""bootstrap"": false, ""ccp_alpha"": 0.001, ""clip_q"": 0.005, ""criterion"": ""squared_error"", ""max_depth"": 32, ""max_features"": 1.0, ""min_impurity_decrease"": 1e-05, ""min_samples_leaf"": 1, ""min_samples_split"": 2, ""synthetic_weight"": 0.7}",PRUNED
44,45.77437000549779,2026-09-27 17:48:19.256185,2026-09-27 17:48:34.040729,0 days 00:00:14.784544,False,0.0,0.0025,squared_error,,0.25,,0.01,2,2,0.75,"{""bootstrap"": false, ""ccp_alpha"": 0.0, ""clip_q"": 0.0025, ""criterion"": ""squared_error"", ""max_depth"": null, ""max_features"": 0.25, ""min_impurity_decrease"": 0.01, ""min_samples_leaf"": 2, ""min_samples_split"": 2, ""synthetic_weight"": 0.75}",COMPLETE
45,47.523259466504754,2026-09-27 17:48:34.094460,2026-09-27 17:48:52.908526,0 days 00:00:18.814066,False,0.0,0.0025,squared_error,40.0,0.35,,0.0,4,4,0.75,"{""bootstrap"": false, ""ccp_alpha"": 0.0, ""clip_q"": 0.0025, ""criterion"": ""squared_error"", ""max_depth"": 40, ""max_features"": 0.35, ""min_impurity_decrease"": 0.0, ""min_samples_leaf"": 4, ""min_samples_split"": 4, ""synthetic_weight"": 0.75}",COMPLETE
46,47.574104888823726,2026-09-27 17:48:52.969348,2026-09-27 17:49:12.242594,0 days 00:00:19.273246,False,0.0,0.01,squared_error,20.0,0.35,,1e-05,3,2,0.9,"{""bootstrap"": false, ""ccp_alpha"": 0.0, ""clip_q"": 0.01, ""criterion"": ""squared_error"", ""max_depth"": 20, ""max_features"": 0.35, ""min_impurity_decrease"": 1e-05, ""min_samples_leaf"": 3, ""min_samples_split"": 2, ""synthetic_weight"": 0.9}",COMPLETE
47,48.037952539405715,2026-09-27 17:49:12.295582,2026-09-27 17:49:15.963688,0 days 00:00:03.668106,False,0.0,0.01,squared_error,,log2,,1e-05,1,3,0.6,"{""bootstrap"": false, ""ccp_alpha"": 0.0, ""clip_q"": 0.01, ""criterion"": ""squared_error"", ""max_depth"": null, ""max_features"": ""log2"", ""min_impurity_decrease"": 1e-05, ""min_samples_leaf"": 1, ""min_samples_split"": 3, ""synthetic_weight"": 0.6}",COMPLETE
48,49.63875496389825,2026-09-27 17:49:16.016907,2026-09-27 17:49:53.490364,0 days 00:00:37.473457,False,0.0,0.005,squared_error,32.0,0.7,,1e-05,4,3,0.75,"{""bootstrap"": false, ""ccp_alpha"": 0.0, ""clip_q"": 0.005, ""criterion"": ""squared_error"", ""max_depth"": 32, ""max_features"": 0.7, ""min_impurity_decrease"": 1e-05, ""min_samples_leaf"": 4, ""min_samples_split"": 3, ""synthetic_weight"": 0.75}",COMPLETE
49,47.80006420950947,2026-09-27 17:49:53.544886,2026-09-27 17:50:22.596517,0 days 00:00:29.051631,False,0.0,0.01,squared_error,32.0,0.5,,1e-05,2,4,0.9,"{""bootstrap"": false, ""ccp_alpha"": 0.0, ""clip_q"": 0.01, ""criterion"": ""squared_error"", ""max_depth"": 32, ""max_features"": 0.5, ""min_impurity_decrease"": 1e-05, ""min_samples_leaf"": 2, ""min_samples_split"": 4, ""synthetic_weight"": 0.9}",COMPLETE
50,67.32194796598247,2026-09-27 17:50:22.650101,2026-09-27 17:50:58.345831,0 days 00:00:35.695730,False,1e-05,0.0025,squared_error,32.0,1.0,,1e-05,3,4,0.7,"{""bootstrap"": false, ""ccp_alpha"": 1e-05, ""clip_q"": 0.0025, ""criterion"": ""squared_error"", ""max_depth"": 32, ""max_features"": 1.0, ""min_impurity_decrease"": 1e-05, ""min_samples_leaf"": 3, ""min_samples_split"": 4, ""synthetic_weight"": 0.7}",PRUNED
51,45.77437000549779,2026-09-27 17:50:58.405823,2026-09-27 17:51:13.352669,0 days 00:00:14.946846,False,0.001,0.0,squared_error,,0.25,,0.01,2,2,0.75,"{""bootstrap"": false, ""ccp_alpha"": 0.001, ""clip_q"": 0.0, ""criterion"": ""squared_error"", ""max_depth"": null, ""max_features"": 0.25, ""min_impurity_decrease"": 0.01, ""min_samples_leaf"": 2, ""min_samples_split"": 2, ""synthetic_weight"": 0.75}",COMPLETE
52,46.94485764609349,2026-09-27 17:51:13.406283,2026-09-27 17:51:19.247501,0 days 00:00:05.841218,False,0.0,0.01,squared_error,32.0,0.08,,0.0001,1,4,0.3,"{""bootstrap"": false, ""ccp_alpha"": 0.0, ""clip_q"": 0.01, ""criterion"": ""squared_error"", ""max_depth"": 32, ""max_features"": 0.08, ""min_impurity_decrease"": 0.0001, ""min_samples_leaf"": 1, ""min_samples_split"": 4, ""synthetic_weight"": 0.3}",COMPLETE
53,45.8561643698891,2026-09-27 17:51:19.301389,2026-09-27 17:51:34.241118,0 days 00:00:14.939729,False,0.001,0.0,squared_error,20.0,0.25,,0.01,1,4,0.75,"{""bootstrap"": false, ""ccp_alpha"": 0.001, ""clip_q"": 0.0, ""criterion"": ""squared_error"", ""max_depth"": 20, ""max_features"": 0.25, ""min_impurity_decrease"": 0.01, ""min_samples_leaf"": 1, ""min_samples_split"": 4, ""synthetic_weight"": 0.75}",COMPLETE
54,46.16032441931182,2026-09-27 17:51:34.300597,2026-09-27 17:51:48.268207,0 days 00:00:13.967610,False,0.0,0.0025,squared_error,24.0,0.25,,0.01,3,2,0.75,"{""bootstrap"": false, ""ccp_alpha"": 0.0, ""clip_q"": 0.0025, ""criterion"": ""squared_error"", ""max_depth"": 24, ""max_features"": 0.25, ""min_impurity_decrease"": 0.01, ""min_samples_leaf"": 3, ""min_samples_split"": 2, ""synthetic_weight"": 0.75}",COMPLETE
55,46.190119197670846,2026-09-27 17:51:48.322794,2026-09-27 17:52:02.384926,0 days 00:00:14.062132,False,0.0,0.0025,squared_error,,0.25,,0.01,3,6,0.75,"{""bootstrap"": false, ""ccp_alpha"": 0.0, ""clip_q"": 0.0025, ""criterion"": ""squared_error"", ""max_depth"": null, ""max_features"": 0.25, ""min_impurity_decrease"": 0.01, ""min_samples_leaf"": 3, ""min_samples_split"": 6, ""synthetic_weight"": 0.75}",COMPLETE
56,46.54816447405286,2026-09-27 17:52:02.438740,2026-09-27 17:52:16.594469,0 days 00:00:14.155729,False,0.001,0.0025,squared_error,,0.25,,0.01,3,3,0.9,"{""bootstrap"": false, ""ccp_alpha"": 0.001, ""clip_q"": 0.0025, ""criterion"": ""squared_error"", ""max_depth"": null, ""max_features"": 0.25, ""min_impurity_decrease"": 0.01, ""min_samples_leaf"": 3, ""min_samples_split"": 3, ""synthetic_weight"": 0.9}",COMPLETE
57,45.71212088749513,2026-09-27 17:52:16.648615,2026-09-27 17:52:32.111581,0 days 00:00:15.462966,False,0.0,0.0025,squared_error,24.0,0.25,,0.01,1,3,0.9,"{""bootstrap"": false, ""ccp_alpha"": 0.0, ""clip_q"": 0.0025, ""criterion"": ""squared_error"", ""max_depth"": 24, ""max_features"": 0.25, ""min_impurity_decrease"": 0.01, ""min_samples_leaf"": 1, ""min_samples_split"": 3, ""synthetic_weight"": 0.9}",COMPLETE
