number,value,datetime_start,datetime_complete,duration,params_bootstrap,params_ccp_alpha,params_clip_q,params_criterion,params_max_depth,params_max_features,params_max_samples,params_min_impurity_decrease,params_min_samples_leaf,params_min_samples_split,params_synthetic_weight,system_attrs_tpe:relative_params:0,state
0,48.80515223915696,2026-09-27 17:17:16.782348,2026-09-27 17:17:38.978255,0 days 00:00:22.195907,False,1e-05,0.01,squared_error,40.0,0.35,,0.001,1,7,0.1,,COMPLETE
1,68.0561972838583,2026-09-27 17:17:39.040468,2026-09-27 17:18:24.844151,0 days 00:00:45.803683,False,1e-06,0.001,squared_error,24.0,1.0,,0.001,8,14,0.2,,COMPLETE
2,60.77329133023867,2026-09-27 17:18:24.900251,2026-09-27 17:18:35.201346,0 days 00:00:10.301095,True,0.001,0.01,squared_error,,1.0,0.9210347179474957,0.01,8,13,0.25,,COMPLETE
3,53.468121372613936,2026-09-27 17:18:35.262896,2026-09-27 17:18:39.744895,0 days 00:00:04.481999,False,1e-05,0.005,squared_error,40.0,sqrt,,0.01,9,8,0.2,,COMPLETE
4,49.037402478332595,2026-09-27 17:18:39.803507,2026-09-27 17:18:46.242743,0 days 00:00:06.439236,False,1e-06,0.0005,squared_error,16.0,0.12,,0.0,7,6,0.65,,COMPLETE
5,53.762048231410134,2026-09-27 17:18:46.298576,2026-09-27 17:18:59.875094,0 days 00:00:13.576518,True,0.001,0.01,squared_error,40.0,0.5,0.927424521398035,1e-05,5,20,1.0,,COMPLETE
6,58.0756607926813,2026-09-27 17:18:59.938778,2026-09-27 17:19:17.084898,0 days 00:00:17.146120,True,0.0,0.005,absolute_error,20.0,0.18,0.8568189246324989,0.0001,8,7,0.6,,COMPLETE
7,60.29703811933625,2026-09-27 17:19:17.144176,2026-09-27 17:19:19.544999,0 days 00:00:02.400823,True,0.0,0.001,squared_error,,sqrt,0.6409381782775996,0.01,8,10,0.55,,COMPLETE
8,66.48597764496216,2026-09-27 17:19:19.605712,2026-09-27 17:19:21.812177,0 days 00:00:02.206465,True,0.0001,0.005,squared_error,40.0,sqrt,0.6522833047149669,0.0,7,7,0.15,,COMPLETE
9,68.24114342930469,2026-09-27 17:19:21.870028,2026-09-27 17:19:26.324123,0 days 00:00:04.454095,True,0.0001,0.001,absolute_error,16.0,0.12,0.857270593823643,0.001,9,13,0.1,,COMPLETE
10,62.09437817002472,2026-09-27 17:19:26.381408,2026-09-27 17:19:28.704520,0 days 00:00:02.323112,True,0.0001,0.005,squared_error,,log2,0.9932524439732059,1e-05,9,13,0.4,,COMPLETE
11,47.54754468035249,2026-09-27 17:19:28.760912,2026-09-27 17:19:35.722061,0 days 00:00:06.961149,False,1e-05,0.0,squared_error,20.0,0.12,,0.0001,3,14,0.45,,COMPLETE
12,48.66578983157977,2026-09-27 17:19:35.778509,2026-09-27 17:19:57.827593,0 days 00:00:22.049084,False,1e-05,0.01,squared_error,,0.35,,0.0,2,5,0.1,"{""bootstrap"": false, ""ccp_alpha"": 1e-05, ""clip_q"": 0.01, ""criterion"": ""squared_error"", ""max_depth"": null, ""max_features"": 0.35, ""min_impurity_decrease"": 0.0, ""min_samples_leaf"": 2, ""min_samples_split"": 5, ""synthetic_weight"": 0.1}",COMPLETE
13,46.62979739476979,2026-09-27 17:19:57.889853,2026-09-27 17:20:10.087833,0 days 00:00:12.197980,False,1e-05,0.005,squared_error,20.0,0.18,,0.0,2,3,0.15,"{""bootstrap"": false, ""ccp_alpha"": 1e-05, ""clip_q"": 0.005, ""criterion"": ""squared_error"", ""max_depth"": 20, ""max_features"": 0.18, ""min_impurity_decrease"": 0.0, ""min_samples_leaf"": 2, ""min_samples_split"": 3, ""synthetic_weight"": 0.15}",COMPLETE
14,50.961226018408055,2026-09-27 17:20:10.151661,2026-09-27 17:20:20.091375,0 days 00:00:09.939714,False,0.0001,0.005,squared_error,48.0,0.18,,0.0,2,19,0.15,"{""bootstrap"": false, ""ccp_alpha"": 0.0001, ""clip_q"": 0.005, ""criterion"": ""squared_error"", ""max_depth"": 48, ""max_features"": 0.18, ""min_impurity_decrease"": 0.0, ""min_samples_leaf"": 2, ""min_samples_split"": 19, ""synthetic_weight"": 0.15}",COMPLETE
15,44.80609338043204,2026-09-27 17:20:20.149618,2026-09-27 17:20:27.962169,0 days 00:00:07.812551,False,1e-05,0.005,squared_error,20.0,0.12,,0.0001,1,9,0.95,"{""bootstrap"": false, ""ccp_alpha"": 1e-05, ""clip_q"": 0.005, ""criterion"": ""squared_error"", ""max_depth"": 20, ""max_features"": 0.12, ""min_impurity_decrease"": 0.0001, ""min_samples_leaf"": 1, ""min_samples_split"": 9, ""synthetic_weight"": 0.95}",COMPLETE
16,45.82402280405251,2026-09-27 17:20:28.021073,2026-09-27 17:20:39.049049,0 days 00:00:11.027976,False,1e-05,0.005,squared_error,20.0,0.18,,0.0,1,7,0.3,"{""bootstrap"": false, ""ccp_alpha"": 1e-05, ""clip_q"": 0.005, ""criterion"": ""squared_error"", ""max_depth"": 20, ""max_features"": 0.18, ""min_impurity_decrease"": 0.0, ""min_samples_leaf"": 1, ""min_samples_split"": 7, ""synthetic_weight"": 0.3}",COMPLETE
17,51.09433865484802,2026-09-27 17:20:39.109130,2026-09-27 17:20:46.471153,0 days 00:00:07.362023,False,1e-05,0.005,squared_error,48.0,0.12,,1e-05,4,2,0.05,"{""bootstrap"": false, ""ccp_alpha"": 1e-05, ""clip_q"": 0.005, ""criterion"": ""squared_error"", ""max_depth"": 48, ""max_features"": 0.12, ""min_impurity_decrease"": 1e-05, ""min_samples_leaf"": 4, ""min_samples_split"": 2, ""synthetic_weight"": 0.05}",COMPLETE
18,49.723752199144336,2026-09-27 17:20:46.529215,2026-09-27 17:21:04.182230,0 days 00:00:17.653015,False,1e-05,0.005,squared_error,20.0,0.35,,0.0,5,11,0.55,"{""bootstrap"": false, ""ccp_alpha"": 1e-05, ""clip_q"": 0.005, ""criterion"": ""squared_error"", ""max_depth"": 20, ""max_features"": 0.35, ""min_impurity_decrease"": 0.0, ""min_samples_leaf"": 5, ""min_samples_split"": 11, ""synthetic_weight"": 0.55}",COMPLETE
19,51.80773234135775,2026-09-27 17:21:04.241793,2026-09-27 17:21:08.593385,0 days 00:00:04.351592,True,1e-05,0.005,squared_error,24.0,0.12,0.7494845984272596,0.0001,1,9,0.9,"{""bootstrap"": true, ""ccp_alpha"": 1e-05, ""clip_q"": 0.005, ""criterion"": ""squared_error"", ""max_depth"": 24, ""max_features"": 0.12, ""min_impurity_decrease"": 0.0001, ""min_samples_leaf"": 1, ""min_samples_split"": 9, ""synthetic_weight"": 0.9}",COMPLETE
20,46.12253843202897,2026-09-27 17:21:08.653606,2026-09-27 17:21:13.445789,0 days 00:00:04.792183,False,0.001,0.0005,squared_error,20.0,sqrt,,0.001,3,10,0.95,"{""bootstrap"": false, ""ccp_alpha"": 0.001, ""clip_q"": 0.0005, ""criterion"": ""squared_error"", ""max_depth"": 20, ""max_features"": ""sqrt"", ""min_impurity_decrease"": 0.001, ""min_samples_leaf"": 3, ""min_samples_split"": 10, ""synthetic_weight"": 0.95}",COMPLETE
21,48.21905300867488,2026-09-27 17:21:13.505548,2026-09-27 17:21:50.521686,0 days 00:00:37.016138,False,1e-05,0.001,squared_error,20.0,0.7,,0.0001,1,9,0.95,"{""bootstrap"": false, ""ccp_alpha"": 1e-05, ""clip_q"": 0.001, ""criterion"": ""squared_error"", ""max_depth"": 20, ""max_features"": 0.7, ""min_impurity_decrease"": 0.0001, ""min_samples_leaf"": 1, ""min_samples_split"": 9, ""synthetic_weight"": 0.95}",COMPLETE
22,47.06499218654854,2026-09-27 17:21:50.581649,2026-09-27 17:21:55.618366,0 days 00:00:05.036717,False,0.001,0.0005,squared_error,,sqrt,,0.001,1,11,0.25,"{""bootstrap"": false, ""ccp_alpha"": 0.001, ""clip_q"": 0.0005, ""criterion"": ""squared_error"", ""max_depth"": null, ""max_features"": ""sqrt"", ""min_impurity_decrease"": 0.001, ""min_samples_leaf"": 1, ""min_samples_split"": 11, ""synthetic_weight"": 0.25}",COMPLETE
23,47.609732304813896,2026-09-27 17:21:55.677174,2026-09-27 17:22:00.571868,0 days 00:00:04.894694,False,0.001,0.0005,squared_error,24.0,0.08,,0.001,5,12,0.95,"{""bootstrap"": false, ""ccp_alpha"": 0.001, ""clip_q"": 0.0005, ""criterion"": ""squared_error"", ""max_depth"": 24, ""max_features"": 0.08, ""min_impurity_decrease"": 0.001, ""min_samples_leaf"": 5, ""min_samples_split"": 12, ""synthetic_weight"": 0.95}",COMPLETE
24,44.026791650181316,2026-09-27 17:22:00.628922,2026-09-27 17:22:08.306630,0 days 00:00:07.677708,False,1e-05,0.0005,squared_error,40.0,0.12,,0.0001,1,5,0.95,"{""bootstrap"": false, ""ccp_alpha"": 1e-05, ""clip_q"": 0.0005, ""criterion"": ""squared_error"", ""max_depth"": 40, ""max_features"": 0.12, ""min_impurity_decrease"": 0.0001, ""min_samples_leaf"": 1, ""min_samples_split"": 5, ""synthetic_weight"": 0.95}",COMPLETE
25,51.01070181866409,2026-09-27 17:22:08.365174,2026-09-27 17:22:22.484445,0 days 00:00:14.119271,True,1e-05,0.0005,squared_error,20.0,0.5,0.7398833070929978,0.0001,1,3,0.95,"{""bootstrap"": true, ""ccp_alpha"": 1e-05, ""clip_q"": 0.0005, ""criterion"": ""squared_error"", ""max_depth"": 20, ""max_features"": 0.5, ""min_impurity_decrease"": 0.0001, ""min_samples_leaf"": 1, ""min_samples_split"": 3, ""synthetic_weight"": 0.95}",COMPLETE
26,47.98365299344849,2026-09-27 17:22:22.544796,2026-09-27 17:22:30.390477,0 days 00:00:07.845681,False,0.001,0.01,squared_error,40.0,0.12,,0.0001,1,5,0.05,"{""bootstrap"": false, ""ccp_alpha"": 0.001, ""clip_q"": 0.01, ""criterion"": ""squared_error"", ""max_depth"": 40, ""max_features"": 0.12, ""min_impurity_decrease"": 0.0001, ""min_samples_leaf"": 1, ""min_samples_split"": 5, ""synthetic_weight"": 0.05}",COMPLETE
27,51.42073976450608,2026-09-27 17:22:30.448258,2026-09-27 17:22:51.591340,0 days 00:00:21.143082,False,1e-05,0.005,absolute_error,20.0,0.08,,0.0,5,6,0.3,"{""bootstrap"": false, ""ccp_alpha"": 1e-05, ""clip_q"": 0.005, ""criterion"": ""absolute_error"", ""max_depth"": 20, ""max_features"": 0.08, ""min_impurity_decrease"": 0.0, ""min_samples_leaf"": 5, ""min_samples_split"": 6, ""synthetic_weight"": 0.3}",COMPLETE
28,51.3528179974355,2026-09-27 17:22:51.650687,2026-09-27 17:25:32.547423,0 days 00:02:40.896736,False,1e-05,0.005,absolute_error,20.0,0.7,,0.0,2,12,0.35,"{""bootstrap"": false, ""ccp_alpha"": 1e-05, ""clip_q"": 0.005, ""criterion"": ""absolute_error"", ""max_depth"": 20, ""max_features"": 0.7, ""min_impurity_decrease"": 0.0, ""min_samples_leaf"": 2, ""min_samples_split"": 12, ""synthetic_weight"": 0.35}",COMPLETE
29,46.90506223122547,2026-09-27 17:25:32.606634,2026-09-27 17:25:53.767619,0 days 00:00:21.160985,False,1e-05,0.0025,squared_error,40.0,0.35,,0.0001,1,2,0.6,"{""bootstrap"": false, ""ccp_alpha"": 1e-05, ""clip_q"": 0.0025, ""criterion"": ""squared_error"", ""max_depth"": 40, ""max_features"": 0.35, ""min_impurity_decrease"": 0.0001, ""min_samples_leaf"": 1, ""min_samples_split"": 2, ""synthetic_weight"": 0.6}",COMPLETE
30,60.244105729806854,2026-09-27 17:25:53.819907,2026-09-27 17:25:55.146612,0 days 00:00:01.326705,True,1e-05,0.0005,squared_error,20.0,0.12,0.7433094131088056,0.01,2,7,0.1,"{""bootstrap"": true, ""ccp_alpha"": 1e-05, ""clip_q"": 0.0005, ""criterion"": ""squared_error"", ""max_depth"": 20, ""max_features"": 0.12, ""min_impurity_decrease"": 0.01, ""min_samples_leaf"": 2, ""min_samples_split"": 7, ""synthetic_weight"": 0.1}",PRUNED
31,45.96516593512523,2026-09-27 17:25:55.199104,2026-09-27 17:26:16.345184,0 days 00:00:21.146080,False,1e-05,0.0005,absolute_error,40.0,sqrt,,0.01,2,3,0.95,"{""bootstrap"": false, ""ccp_alpha"": 1e-05, ""clip_q"": 0.0005, ""criterion"": ""absolute_error"", ""max_depth"": 40, ""max_features"": ""sqrt"", ""min_impurity_decrease"": 0.01, ""min_samples_leaf"": 2, ""min_samples_split"": 3, ""synthetic_weight"": 0.95}",COMPLETE
32,48.07084345078794,2026-09-27 17:26:16.397891,2026-09-27 17:26:35.910289,0 days 00:00:19.512398,False,1e-05,0.01,absolute_error,40.0,sqrt,,0.01,4,2,0.95,"{""bootstrap"": false, ""ccp_alpha"": 1e-05, ""clip_q"": 0.01, ""criterion"": ""absolute_error"", ""max_depth"": 40, ""max_features"": ""sqrt"", ""min_impurity_decrease"": 0.01, ""min_samples_leaf"": 4, ""min_samples_split"": 2, ""synthetic_weight"": 0.95}",COMPLETE
33,52.07871526058307,2026-09-27 17:26:35.968358,2026-09-27 17:26:57.071887,0 days 00:00:21.103529,False,1e-05,0.0005,absolute_error,40.0,sqrt,,0.01,2,4,0.1,"{""bootstrap"": false, ""ccp_alpha"": 1e-05, ""clip_q"": 0.0005, ""criterion"": ""absolute_error"", ""max_depth"": 40, ""max_features"": ""sqrt"", ""min_impurity_decrease"": 0.01, ""min_samples_leaf"": 2, ""min_samples_split"": 4, ""synthetic_weight"": 0.1}",COMPLETE
34,45.40651548880182,2026-09-27 17:26:57.125050,2026-09-27 17:27:04.002984,0 days 00:00:06.877934,False,1e-05,0.0,squared_error,20.0,0.12,,0.0,2,9,0.7,"{""bootstrap"": false, ""ccp_alpha"": 1e-05, ""clip_q"": 0.0, ""criterion"": ""squared_error"", ""max_depth"": 20, ""max_features"": 0.12, ""min_impurity_decrease"": 0.0, ""min_samples_leaf"": 2, ""min_samples_split"": 9, ""synthetic_weight"": 0.7}",COMPLETE
35,48.77851997030806,2026-09-27 17:27:04.061877,2026-09-27 17:27:30.201620,0 days 00:00:26.139743,False,1e-05,0.0,squared_error,20.0,0.5,,1e-05,2,7,0.7,"{""bootstrap"": false, ""ccp_alpha"": 1e-05, ""clip_q"": 0.0, ""criterion"": ""squared_error"", ""max_depth"": 20, ""max_features"": 0.5, ""min_impurity_decrease"": 1e-05, ""min_samples_leaf"": 2, ""min_samples_split"": 7, ""synthetic_weight"": 0.7}",COMPLETE
36,44.771701937905604,2026-09-27 17:27:30.253738,2026-09-27 17:27:37.661396,0 days 00:00:07.407658,False,1e-05,0.005,squared_error,48.0,0.12,,0.0,1,5,0.3,"{""bootstrap"": false, ""ccp_alpha"": 1e-05, ""clip_q"": 0.005, ""criterion"": ""squared_error"", ""max_depth"": 48, ""max_features"": 0.12, ""min_impurity_decrease"": 0.0, ""min_samples_leaf"": 1, ""min_samples_split"": 5, ""synthetic_weight"": 0.3}",COMPLETE
37,47.26491394751535,2026-09-27 17:27:37.720476,2026-09-27 17:27:56.484593,0 days 00:00:18.764117,False,1e-05,0.0005,squared_error,40.0,0.35,,0.0001,2,6,0.95,"{""bootstrap"": false, ""ccp_alpha"": 1e-05, ""clip_q"": 0.0005, ""criterion"": ""squared_error"", ""max_depth"": 40, ""max_features"": 0.35, ""min_impurity_decrease"": 0.0001, ""min_samples_leaf"": 2, ""min_samples_split"": 6, ""synthetic_weight"": 0.95}",COMPLETE
38,45.257578428645225,2026-09-27 17:27:56.537836,2026-09-27 17:28:03.455005,0 days 00:00:06.917169,False,0.0,0.0025,squared_error,40.0,0.12,,0.0,3,4,0.55,"{""bootstrap"": false, ""ccp_alpha"": 0.0, ""clip_q"": 0.0025, ""criterion"": ""squared_error"", ""max_depth"": 40, ""max_features"": 0.12, ""min_impurity_decrease"": 0.0, ""min_samples_leaf"": 3, ""min_samples_split"": 4, ""synthetic_weight"": 0.55}",COMPLETE
39,44.95351457124691,2026-09-27 17:28:03.508936,2026-09-27 17:28:10.471513,0 days 00:00:06.962577,False,0.0,0.0025,squared_error,40.0,0.12,,0.0,2,7,0.55,"{""bootstrap"": false, ""ccp_alpha"": 0.0, ""clip_q"": 0.0025, ""criterion"": ""squared_error"", ""max_depth"": 40, ""max_features"": 0.12, ""min_impurity_decrease"": 0.0, ""min_samples_leaf"": 2, ""min_samples_split"": 7, ""synthetic_weight"": 0.55}",COMPLETE
40,46.13631599545222,2026-09-27 17:28:10.530021,2026-09-27 17:28:17.169577,0 days 00:00:06.639556,False,0.0,0.0025,squared_error,32.0,0.12,,0.001,3,10,0.55,"{""bootstrap"": false, ""ccp_alpha"": 0.0, ""clip_q"": 0.0025, ""criterion"": ""squared_error"", ""max_depth"": 32, ""max_features"": 0.12, ""min_impurity_decrease"": 0.001, ""min_samples_leaf"": 3, ""min_samples_split"": 10, ""synthetic_weight"": 0.55}",COMPLETE
41,46.85961545738975,2026-09-27 17:28:17.226065,2026-09-27 17:28:51.451846,0 days 00:00:34.225781,False,0.0,0.0025,absolute_error,24.0,0.12,,0.0,2,6,0.5,"{""bootstrap"": false, ""ccp_alpha"": 0.0, ""clip_q"": 0.0025, ""criterion"": ""absolute_error"", ""max_depth"": 24, ""max_features"": 0.12, ""min_impurity_decrease"": 0.0, ""min_samples_leaf"": 2, ""min_samples_split"": 6, ""synthetic_weight"": 0.5}",COMPLETE
42,50.27469401657705,2026-09-27 17:28:51.506628,2026-09-27 17:29:16.321920,0 days 00:00:24.815292,False,0.0,0.0025,squared_error,40.0,0.5,,0.0,4,7,0.55,"{""bootstrap"": false, ""ccp_alpha"": 0.0, ""clip_q"": 0.0025, ""criterion"": ""squared_error"", ""max_depth"": 40, ""max_features"": 0.5, ""min_impurity_decrease"": 0.0, ""min_samples_leaf"": 4, ""min_samples_split"": 7, ""synthetic_weight"": 0.55}",COMPLETE
43,45.411158193937396,2026-09-27 17:29:16.379939,2026-09-27 17:29:23.728300,0 days 00:00:07.348361,False,1e-05,0.0005,squared_error,,0.12,,0.0001,2,2,0.2,"{""bootstrap"": false, ""ccp_alpha"": 1e-05, ""clip_q"": 0.0005, ""criterion"": ""squared_error"", ""max_depth"": null, ""max_features"": 0.12, ""min_impurity_decrease"": 0.0001, ""min_samples_leaf"": 2, ""min_samples_split"": 2, ""synthetic_weight"": 0.2}",COMPLETE
44,45.622609096219456,2026-09-27 17:29:23.780715,2026-09-27 17:29:28.728864,0 days 00:00:04.948149,False,1e-05,0.0005,squared_error,32.0,0.08,,0.0001,2,9,0.6,"{""bootstrap"": false, ""ccp_alpha"": 1e-05, ""clip_q"": 0.0005, ""criterion"": ""squared_error"", ""max_depth"": 32, ""max_features"": 0.08, ""min_impurity_decrease"": 0.0001, ""min_samples_leaf"": 2, ""min_samples_split"": 9, ""synthetic_weight"": 0.6}",COMPLETE
45,49.1710962961529,2026-09-27 17:29:28.781945,2026-09-27 17:29:59.617668,0 days 00:00:30.835723,False,0.0,0.0025,absolute_error,40.0,0.12,,0.0,4,5,0.35,"{""bootstrap"": false, ""ccp_alpha"": 0.0, ""clip_q"": 0.0025, ""criterion"": ""absolute_error"", ""max_depth"": 40, ""max_features"": 0.12, ""min_impurity_decrease"": 0.0, ""min_samples_leaf"": 4, ""min_samples_split"": 5, ""synthetic_weight"": 0.35}",COMPLETE
46,46.26037114427545,2026-09-27 17:29:59.670345,2026-09-27 17:30:03.168527,0 days 00:00:03.498182,False,1e-05,0.0025,squared_error,48.0,log2,,0.0,1,5,0.3,"{""bootstrap"": false, ""ccp_alpha"": 1e-05, ""clip_q"": 0.0025, ""criterion"": ""squared_error"", ""max_depth"": 48, ""max_features"": ""log2"", ""min_impurity_decrease"": 0.0, ""min_samples_leaf"": 1, ""min_samples_split"": 5, ""synthetic_weight"": 0.3}",COMPLETE
47,45.935733296127424,2026-09-27 17:30:03.222652,2026-09-27 17:30:40.506406,0 days 00:00:37.283754,False,1e-05,0.005,absolute_error,48.0,0.12,,0.0001,1,5,0.75,"{""bootstrap"": false, ""ccp_alpha"": 1e-05, ""clip_q"": 0.005, ""criterion"": ""absolute_error"", ""max_depth"": 48, ""max_features"": 0.12, ""min_impurity_decrease"": 0.0001, ""min_samples_leaf"": 1, ""min_samples_split"": 5, ""synthetic_weight"": 0.75}",COMPLETE
48,48.02061918480761,2026-09-27 17:30:40.565108,2026-09-27 17:30:46.839493,0 days 00:00:06.274385,False,0.0,0.0025,squared_error,40.0,0.12,,0.0001,6,3,0.55,"{""bootstrap"": false, ""ccp_alpha"": 0.0, ""clip_q"": 0.0025, ""criterion"": ""squared_error"", ""max_depth"": 40, ""max_features"": 0.12, ""min_impurity_decrease"": 0.0001, ""min_samples_leaf"": 6, ""min_samples_split"": 3, ""synthetic_weight"": 0.55}",COMPLETE
49,48.465863176808774,2026-09-27 17:30:46.892942,2026-09-27 17:31:14.266690,0 days 00:00:27.373748,False,0.0,0.0025,squared_error,40.0,0.5,,0.0,2,3,0.55,"{""bootstrap"": false, ""ccp_alpha"": 0.0, ""clip_q"": 0.0025, ""criterion"": ""squared_error"", ""max_depth"": 40, ""max_features"": 0.5, ""min_impurity_decrease"": 0.0, ""min_samples_leaf"": 2, ""min_samples_split"": 3, ""synthetic_weight"": 0.55}",COMPLETE
50,62.65027849655695,2026-09-27 17:31:14.320625,2026-09-27 17:31:44.594321,0 days 00:00:30.273696,False,1e-05,0.005,squared_error,32.0,1.0,,0.0001,3,10,0.95,"{""bootstrap"": false, ""ccp_alpha"": 1e-05, ""clip_q"": 0.005, ""criterion"": ""squared_error"", ""max_depth"": 32, ""max_features"": 1.0, ""min_impurity_decrease"": 0.0001, ""min_samples_leaf"": 3, ""min_samples_split"": 10, ""synthetic_weight"": 0.95}",PRUNED
51,45.67871161811646,2026-09-27 17:31:44.652721,2026-09-27 17:31:51.357456,0 days 00:00:06.704735,False,1e-05,0.0,squared_error,32.0,0.12,,0.0,3,9,0.7,"{""bootstrap"": false, ""ccp_alpha"": 1e-05, ""clip_q"": 0.0, ""criterion"": ""squared_error"", ""max_depth"": 32, ""max_features"": 0.12, ""min_impurity_decrease"": 0.0, ""min_samples_leaf"": 3, ""min_samples_split"": 9, ""synthetic_weight"": 0.7}",COMPLETE
52,44.54353817172267,2026-09-27 17:31:51.411642,2026-09-27 17:31:58.605946,0 days 00:00:07.194304,False,1e-06,0.0,squared_error,32.0,0.12,,0.0,1,7,0.7,"{""bootstrap"": false, ""ccp_alpha"": 1e-06, ""clip_q"": 0.0, ""criterion"": ""squared_error"", ""max_depth"": 32, ""max_features"": 0.12, ""min_impurity_decrease"": 0.0, ""min_samples_leaf"": 1, ""min_samples_split"": 7, ""synthetic_weight"": 0.7}",COMPLETE
53,45.10533717423807,2026-09-27 17:31:58.659257,2026-09-27 17:32:05.646560,0 days 00:00:06.987303,False,0.0,0.0025,squared_error,40.0,0.12,,0.0,2,8,0.55,"{""bootstrap"": false, ""ccp_alpha"": 0.0, ""clip_q"": 0.0025, ""criterion"": ""squared_error"", ""max_depth"": 40, ""max_features"": 0.12, ""min_impurity_decrease"": 0.0, ""min_samples_leaf"": 2, ""min_samples_split"": 8, ""synthetic_weight"": 0.55}",COMPLETE
54,47.92502115925454,2026-09-27 17:32:05.699873,2026-09-27 17:32:11.955452,0 days 00:00:06.255579,False,1e-05,0.0005,squared_error,12.0,0.12,,1e-05,1,6,0.6,"{""bootstrap"": false, ""ccp_alpha"": 1e-05, ""clip_q"": 0.0005, ""criterion"": ""squared_error"", ""max_depth"": 12, ""max_features"": 0.12, ""min_impurity_decrease"": 1e-05, ""min_samples_leaf"": 1, ""min_samples_split"": 6, ""synthetic_weight"": 0.6}",COMPLETE
55,47.8375537050715,2026-09-27 17:32:12.008294,2026-09-27 17:32:25.868672,0 days 00:00:13.860378,False,0.0,0.0025,squared_error,40.0,0.25,,0.0,1,8,0.15,"{""bootstrap"": false, ""ccp_alpha"": 0.0, ""clip_q"": 0.0025, ""criterion"": ""squared_error"", ""max_depth"": 40, ""max_features"": 0.25, ""min_impurity_decrease"": 0.0, ""min_samples_leaf"": 1, ""min_samples_split"": 8, ""synthetic_weight"": 0.15}",COMPLETE
56,46.260916498777775,2026-09-27 17:32:25.922549,2026-09-27 17:32:32.686800,0 days 00:00:06.764251,False,0.0,0.0025,squared_error,40.0,0.12,,0.0,1,13,0.85,"{""bootstrap"": false, ""ccp_alpha"": 0.0, ""clip_q"": 0.0025, ""criterion"": ""squared_error"", ""max_depth"": 40, ""max_features"": 0.12, ""min_impurity_decrease"": 0.0, ""min_samples_leaf"": 1, ""min_samples_split"": 13, ""synthetic_weight"": 0.85}",COMPLETE
