number,value,datetime_start,datetime_complete,duration,params_bootstrap,params_ccp_alpha,params_clip_q,params_criterion,params_max_depth,params_max_features,params_max_samples,params_min_impurity_decrease,params_min_samples_leaf,params_min_samples_split,params_synthetic_weight,system_attrs_tpe:relative_params:0,state
58,45.694656508495186,2026-09-27 17:52:32.166983,2026-09-27 17:52:48.053368,0 days 00:00:15.886385,False,0.0001,0.0025,squared_error,24.0,0.25,,0.01,1,2,0.55,"{""bootstrap"": false, ""ccp_alpha"": 0.0001, ""clip_q"": 0.0025, ""criterion"": ""squared_error"", ""max_depth"": 24, ""max_features"": 0.25, ""min_impurity_decrease"": 0.01, ""min_samples_leaf"": 1, ""min_samples_split"": 2, ""synthetic_weight"": 0.55}",COMPLETE
59,48.05781316766671,2026-09-27 17:52:48.113044,2026-09-27 17:53:04.901612,0 days 00:00:16.788568,False,0.001,0.0,squared_error,,0.25,,0.01,1,2,0.05,"{""bootstrap"": false, ""ccp_alpha"": 0.001, ""clip_q"": 0.0, ""criterion"": ""squared_error"", ""max_depth"": null, ""max_features"": 0.25, ""min_impurity_decrease"": 0.01, ""min_samples_leaf"": 1, ""min_samples_split"": 2, ""synthetic_weight"": 0.05}",COMPLETE
60,48.52664944631628,2026-09-27 17:53:04.955676,2026-09-27 17:53:45.436313,0 days 00:00:40.480637,False,0.0,0.0025,squared_error,24.0,0.7,,0.01,2,4,0.8,"{""bootstrap"": false, ""ccp_alpha"": 0.0, ""clip_q"": 0.0025, ""criterion"": ""squared_error"", ""max_depth"": 24, ""max_features"": 0.7, ""min_impurity_decrease"": 0.01, ""min_samples_leaf"": 2, ""min_samples_split"": 4, ""synthetic_weight"": 0.8}",COMPLETE
61,45.86243699582398,2026-09-27 17:53:45.490113,2026-09-27 17:54:00.287054,0 days 00:00:14.796941,False,0.0001,0.0,squared_error,20.0,0.25,,0.01,1,5,0.75,"{""bootstrap"": false, ""ccp_alpha"": 0.0001, ""clip_q"": 0.0, ""criterion"": ""squared_error"", ""max_depth"": 20, ""max_features"": 0.25, ""min_impurity_decrease"": 0.01, ""min_samples_leaf"": 1, ""min_samples_split"": 5, ""synthetic_weight"": 0.75}",COMPLETE
62,45.544000446837686,2026-09-27 17:54:00.346608,2026-09-27 17:54:14.989976,0 days 00:00:14.643368,False,0.001,0.0,squared_error,20.0,0.25,,0.01,2,4,0.75,"{""bootstrap"": false, ""ccp_alpha"": 0.001, ""clip_q"": 0.0, ""criterion"": ""squared_error"", ""max_depth"": 20, ""max_features"": 0.25, ""min_impurity_decrease"": 0.01, ""min_samples_leaf"": 2, ""min_samples_split"": 4, ""synthetic_weight"": 0.75}",COMPLETE
63,45.544000446837686,2026-09-27 17:54:15.044610,2026-09-27 17:54:29.652201,0 days 00:00:14.607591,False,0.001,0.0,squared_error,20.0,0.25,,0.01,2,2,0.75,"{""bootstrap"": false, ""ccp_alpha"": 0.001, ""clip_q"": 0.0, ""criterion"": ""squared_error"", ""max_depth"": 20, ""max_features"": 0.25, ""min_impurity_decrease"": 0.01, ""min_samples_leaf"": 2, ""min_samples_split"": 2, ""synthetic_weight"": 0.75}",COMPLETE
64,52.241754293309576,2026-09-27 17:54:29.711277,2026-09-27 17:54:33.075692,0 days 00:00:03.364415,True,0.001,0.0,squared_error,20.0,0.25,0.6064065045368466,0.01,2,2,0.75,"{""bootstrap"": true, ""ccp_alpha"": 0.001, ""clip_q"": 0.0, ""criterion"": ""squared_error"", ""max_depth"": 20, ""max_features"": 0.25, ""min_impurity_decrease"": 0.01, ""min_samples_leaf"": 2, ""min_samples_split"": 2, ""synthetic_weight"": 0.75}",PRUNED
65,49.08123817285737,2026-09-27 17:54:33.129044,2026-09-27 17:55:15.352123,0 days 00:00:42.223079,False,0.0001,0.0025,squared_error,24.0,0.7,,0.01,1,3,0.55,"{""bootstrap"": false, ""ccp_alpha"": 0.0001, ""clip_q"": 0.0025, ""criterion"": ""squared_error"", ""max_depth"": 24, ""max_features"": 0.7, ""min_impurity_decrease"": 0.01, ""min_samples_leaf"": 1, ""min_samples_split"": 3, ""synthetic_weight"": 0.55}",COMPLETE
66,46.70876230996987,2026-09-27 17:55:15.406641,2026-09-27 17:55:29.918763,0 days 00:00:14.512122,False,0.001,0.001,squared_error,20.0,0.25,,0.01,2,5,0.25,"{""bootstrap"": false, ""ccp_alpha"": 0.001, ""clip_q"": 0.001, ""criterion"": ""squared_error"", ""max_depth"": 20, ""max_features"": 0.25, ""min_impurity_decrease"": 0.01, ""min_samples_leaf"": 2, ""min_samples_split"": 5, ""synthetic_weight"": 0.25}",COMPLETE
67,46.37751056026223,2026-09-27 17:55:29.971967,2026-09-27 17:55:44.406664,0 days 00:00:14.434697,False,0.001,0.0,squared_error,,0.25,,0.01,2,7,0.6,"{""bootstrap"": false, ""ccp_alpha"": 0.001, ""clip_q"": 0.0, ""criterion"": ""squared_error"", ""max_depth"": null, ""max_features"": 0.25, ""min_impurity_decrease"": 0.01, ""min_samples_leaf"": 2, ""min_samples_split"": 7, ""synthetic_weight"": 0.6}",COMPLETE
68,46.42677154104908,2026-09-27 17:55:44.459580,2026-09-27 17:55:58.372012,0 days 00:00:13.912432,False,0.0001,0.0025,squared_error,16.0,0.25,,0.01,2,4,0.75,"{""bootstrap"": false, ""ccp_alpha"": 0.0001, ""clip_q"": 0.0025, ""criterion"": ""squared_error"", ""max_depth"": 16, ""max_features"": 0.25, ""min_impurity_decrease"": 0.01, ""min_samples_leaf"": 2, ""min_samples_split"": 4, ""synthetic_weight"": 0.75}",COMPLETE
69,45.56761983242493,2026-09-27 17:55:58.425418,2026-09-27 17:56:10.068741,0 days 00:00:11.643323,False,0.001,0.0,squared_error,20.0,0.18,,0.0,1,3,0.75,"{""bootstrap"": false, ""ccp_alpha"": 0.001, ""clip_q"": 0.0, ""criterion"": ""squared_error"", ""max_depth"": 20, ""max_features"": 0.18, ""min_impurity_decrease"": 0.0, ""min_samples_leaf"": 1, ""min_samples_split"": 3, ""synthetic_weight"": 0.75}",COMPLETE
