number,value,datetime_start,datetime_complete,duration,params_bootstrap,params_ccp_alpha,params_clip_q,params_criterion,params_max_depth,params_max_features,params_max_samples,params_min_impurity_decrease,params_min_samples_leaf,params_min_samples_split,params_synthetic_weight,system_attrs_tpe:relative_params:0,state
57,46.02448702343081,2026-09-27 18:08:32.322935,2026-09-27 18:09:04.959400,0 days 00:00:32.636465,False,1e-06,0.0005,squared_error,24.0,0.7,,0.0001,1,3,0.95,"{""bootstrap"": false, ""ccp_alpha"": 1e-06, ""clip_q"": 0.0005, ""criterion"": ""squared_error"", ""max_depth"": 24, ""max_features"": 0.7, ""min_impurity_decrease"": 0.0001, ""min_samples_leaf"": 1, ""min_samples_split"": 3, ""synthetic_weight"": 0.95}",COMPLETE
58,43.56842792120172,2026-09-27 18:09:05.019729,2026-09-27 18:09:13.663971,0 days 00:00:08.644242,False,1e-05,0.0025,squared_error,20.0,0.18,,0.001,1,5,0.8,"{""bootstrap"": false, ""ccp_alpha"": 1e-05, ""clip_q"": 0.0025, ""criterion"": ""squared_error"", ""max_depth"": 20, ""max_features"": 0.18, ""min_impurity_decrease"": 0.001, ""min_samples_leaf"": 1, ""min_samples_split"": 5, ""synthetic_weight"": 0.8}",COMPLETE
59,47.93239264544405,2026-09-27 18:09:13.718326,2026-09-27 18:09:21.400874,0 days 00:00:07.682548,False,0.0001,0.01,squared_error,24.0,0.18,,0.0001,5,8,0.3,"{""bootstrap"": false, ""ccp_alpha"": 0.0001, ""clip_q"": 0.01, ""criterion"": ""squared_error"", ""max_depth"": 24, ""max_features"": 0.18, ""min_impurity_decrease"": 0.0001, ""min_samples_leaf"": 5, ""min_samples_split"": 8, ""synthetic_weight"": 0.3}",COMPLETE
60,75.44591757512563,2026-09-27 18:09:21.455127,2026-09-27 18:09:22.549482,0 days 00:00:01.094355,False,1e-05,0.0025,squared_error,20.0,0.18,,0.001,3,4,0.0,"{""bootstrap"": false, ""ccp_alpha"": 1e-05, ""clip_q"": 0.0025, ""criterion"": ""squared_error"", ""max_depth"": 20, ""max_features"": 0.18, ""min_impurity_decrease"": 0.001, ""min_samples_leaf"": 3, ""min_samples_split"": 4, ""synthetic_weight"": 0.0}",PRUNED
61,44.22617125625811,2026-09-27 18:09:22.604187,2026-09-27 18:09:30.829463,0 days 00:00:08.225276,False,1e-06,0.0005,squared_error,24.0,0.18,,0.001,2,7,0.85,"{""bootstrap"": false, ""ccp_alpha"": 1e-06, ""clip_q"": 0.0005, ""criterion"": ""squared_error"", ""max_depth"": 24, ""max_features"": 0.18, ""min_impurity_decrease"": 0.001, ""min_samples_leaf"": 2, ""min_samples_split"": 7, ""synthetic_weight"": 0.85}",COMPLETE
62,44.25807662350761,2026-09-27 18:09:30.883161,2026-09-27 18:09:39.246251,0 days 00:00:08.363090,False,0.001,0.0005,squared_error,24.0,0.18,,0.001,2,6,0.85,"{""bootstrap"": false, ""ccp_alpha"": 0.001, ""clip_q"": 0.0005, ""criterion"": ""squared_error"", ""max_depth"": 24, ""max_features"": 0.18, ""min_impurity_decrease"": 0.001, ""min_samples_leaf"": 2, ""min_samples_split"": 6, ""synthetic_weight"": 0.85}",COMPLETE
63,44.02459615639809,2026-09-27 18:09:39.307317,2026-09-27 18:09:47.646734,0 days 00:00:08.339417,False,1e-06,0.0005,squared_error,24.0,0.18,,1e-05,2,7,0.95,"{""bootstrap"": false, ""ccp_alpha"": 1e-06, ""clip_q"": 0.0005, ""criterion"": ""squared_error"", ""max_depth"": 24, ""max_features"": 0.18, ""min_impurity_decrease"": 1e-05, ""min_samples_leaf"": 2, ""min_samples_split"": 7, ""synthetic_weight"": 0.95}",COMPLETE
64,55.21837801891322,2026-09-27 18:09:47.701900,2026-09-27 18:09:49.942613,0 days 00:00:02.240713,True,1e-06,0.0005,squared_error,24.0,0.18,0.6064065045368466,0.001,2,9,0.85,"{""bootstrap"": true, ""ccp_alpha"": 1e-06, ""clip_q"": 0.0005, ""criterion"": ""squared_error"", ""max_depth"": 24, ""max_features"": 0.18, ""min_impurity_decrease"": 0.001, ""min_samples_leaf"": 2, ""min_samples_split"": 9, ""synthetic_weight"": 0.85}",PRUNED
65,44.106978171664096,2026-09-27 18:09:49.998583,2026-09-27 18:09:56.323703,0 days 00:00:06.325120,False,1e-06,0.0005,squared_error,24.0,0.12,,0.0001,1,5,0.95,"{""bootstrap"": false, ""ccp_alpha"": 1e-06, ""clip_q"": 0.0005, ""criterion"": ""squared_error"", ""max_depth"": 24, ""max_features"": 0.12, ""min_impurity_decrease"": 0.0001, ""min_samples_leaf"": 1, ""min_samples_split"": 5, ""synthetic_weight"": 0.95}",COMPLETE
66,43.471501989835424,2026-09-27 18:09:56.377815,2026-09-27 18:10:05.268399,0 days 00:00:08.890584,False,1e-05,0.0,squared_error,20.0,0.18,,0.001,1,4,0.8,"{""bootstrap"": false, ""ccp_alpha"": 1e-05, ""clip_q"": 0.0, ""criterion"": ""squared_error"", ""max_depth"": 20, ""max_features"": 0.18, ""min_impurity_decrease"": 0.001, ""min_samples_leaf"": 1, ""min_samples_split"": 4, ""synthetic_weight"": 0.8}",COMPLETE
67,45.729132641583064,2026-09-27 18:10:05.323288,2026-09-27 18:10:13.284604,0 days 00:00:07.961316,False,1e-06,0.0005,squared_error,24.0,0.18,,0.0001,2,12,0.6,"{""bootstrap"": false, ""ccp_alpha"": 1e-06, ""clip_q"": 0.0005, ""criterion"": ""squared_error"", ""max_depth"": 24, ""max_features"": 0.18, ""min_impurity_decrease"": 0.0001, ""min_samples_leaf"": 2, ""min_samples_split"": 12, ""synthetic_weight"": 0.6}",COMPLETE
68,46.402511135646705,2026-09-27 18:10:13.345495,2026-09-27 18:10:17.768596,0 days 00:00:04.423101,False,1e-05,0.0,squared_error,20.0,0.08,,1e-05,2,3,0.8,"{""bootstrap"": false, ""ccp_alpha"": 1e-05, ""clip_q"": 0.0, ""criterion"": ""squared_error"", ""max_depth"": 20, ""max_features"": 0.08, ""min_impurity_decrease"": 1e-05, ""min_samples_leaf"": 2, ""min_samples_split"": 3, ""synthetic_weight"": 0.8}",COMPLETE
69,43.755520550329166,2026-09-27 18:10:17.823387,2026-09-27 18:10:26.387109,0 days 00:00:08.563722,False,1e-05,0.0005,squared_error,24.0,0.18,,0.0001,1,6,0.95,"{""bootstrap"": false, ""ccp_alpha"": 1e-05, ""clip_q"": 0.0005, ""criterion"": ""squared_error"", ""max_depth"": 24, ""max_features"": 0.18, ""min_impurity_decrease"": 0.0001, ""min_samples_leaf"": 1, ""min_samples_split"": 6, ""synthetic_weight"": 0.95}",COMPLETE
