number,value,datetime_start,datetime_complete,duration,params_bootstrap,params_ccp_alpha,params_clip_q,params_criterion,params_max_depth,params_max_features,params_max_samples,params_min_impurity_decrease,params_min_samples_leaf,params_min_samples_split,params_synthetic_weight,system_attrs_tpe:relative_params:0,state
57,44.38066566684459,2026-09-27 17:32:32.739668,2026-09-27 17:32:40.144790,0 days 00:00:07.405122,False,1e-06,0.0005,squared_error,16.0,0.12,,0.0001,1,2,0.95,"{""bootstrap"": false, ""ccp_alpha"": 1e-06, ""clip_q"": 0.0005, ""criterion"": ""squared_error"", ""max_depth"": 16, ""max_features"": 0.12, ""min_impurity_decrease"": 0.0001, ""min_samples_leaf"": 1, ""min_samples_split"": 2, ""synthetic_weight"": 0.95}",COMPLETE
58,44.68265241099418,2026-09-27 17:32:40.203209,2026-09-27 17:32:47.579213,0 days 00:00:07.376004,False,0.0001,0.0005,squared_error,16.0,0.12,,0.0001,1,2,0.55,"{""bootstrap"": false, ""ccp_alpha"": 0.0001, ""clip_q"": 0.0005, ""criterion"": ""squared_error"", ""max_depth"": 16, ""max_features"": 0.12, ""min_impurity_decrease"": 0.0001, ""min_samples_leaf"": 1, ""min_samples_split"": 2, ""synthetic_weight"": 0.55}",COMPLETE
59,44.97195938195544,2026-09-27 17:32:47.631905,2026-09-27 17:32:54.647012,0 days 00:00:07.015107,False,0.0001,0.0005,squared_error,16.0,0.12,,0.0001,1,5,0.55,"{""bootstrap"": false, ""ccp_alpha"": 0.0001, ""clip_q"": 0.0005, ""criterion"": ""squared_error"", ""max_depth"": 16, ""max_features"": 0.12, ""min_impurity_decrease"": 0.0001, ""min_samples_leaf"": 1, ""min_samples_split"": 5, ""synthetic_weight"": 0.55}",COMPLETE
60,43.85168250573474,2026-09-27 17:32:54.699473,2026-09-27 17:33:02.503312,0 days 00:00:07.803839,False,1e-05,0.005,squared_error,48.0,0.12,,0.01,1,3,0.9,"{""bootstrap"": false, ""ccp_alpha"": 1e-05, ""clip_q"": 0.005, ""criterion"": ""squared_error"", ""max_depth"": 48, ""max_features"": 0.12, ""min_impurity_decrease"": 0.01, ""min_samples_leaf"": 1, ""min_samples_split"": 3, ""synthetic_weight"": 0.9}",COMPLETE
61,44.50651349982158,2026-09-27 17:33:02.557360,2026-09-27 17:33:09.718937,0 days 00:00:07.161577,False,1e-06,0.0005,squared_error,32.0,0.12,,0.0,2,5,0.7,"{""bootstrap"": false, ""ccp_alpha"": 1e-06, ""clip_q"": 0.0005, ""criterion"": ""squared_error"", ""max_depth"": 32, ""max_features"": 0.12, ""min_impurity_decrease"": 0.0, ""min_samples_leaf"": 2, ""min_samples_split"": 5, ""synthetic_weight"": 0.7}",COMPLETE
62,44.34709054882986,2026-09-27 17:33:09.777624,2026-09-27 17:33:17.072651,0 days 00:00:07.295027,False,0.001,0.0005,squared_error,32.0,0.12,,0.0,2,4,0.7,"{""bootstrap"": false, ""ccp_alpha"": 0.001, ""clip_q"": 0.0005, ""criterion"": ""squared_error"", ""max_depth"": 32, ""max_features"": 0.12, ""min_impurity_decrease"": 0.0, ""min_samples_leaf"": 2, ""min_samples_split"": 4, ""synthetic_weight"": 0.7}",COMPLETE
63,44.34709054882986,2026-09-27 17:33:17.126155,2026-09-27 17:33:24.380445,0 days 00:00:07.254290,False,0.001,0.0005,squared_error,32.0,0.12,,0.0,2,2,0.7,"{""bootstrap"": false, ""ccp_alpha"": 0.001, ""clip_q"": 0.0005, ""criterion"": ""squared_error"", ""max_depth"": 32, ""max_features"": 0.12, ""min_impurity_decrease"": 0.0, ""min_samples_leaf"": 2, ""min_samples_split"": 2, ""synthetic_weight"": 0.7}",COMPLETE
64,43.85168250573474,2026-09-27 17:33:24.432975,2026-09-27 17:33:32.144384,0 days 00:00:07.711409,False,1e-05,0.005,squared_error,48.0,0.12,,0.01,1,3,0.9,"{""bootstrap"": false, ""ccp_alpha"": 1e-05, ""clip_q"": 0.005, ""criterion"": ""squared_error"", ""max_depth"": 48, ""max_features"": 0.12, ""min_impurity_decrease"": 0.01, ""min_samples_leaf"": 1, ""min_samples_split"": 3, ""synthetic_weight"": 0.9}",COMPLETE
65,48.08277314728159,2026-09-27 17:33:32.197202,2026-09-27 17:34:11.920414,0 days 00:00:39.723212,False,0.0001,0.005,squared_error,48.0,0.7,,0.01,1,3,0.9,"{""bootstrap"": false, ""ccp_alpha"": 0.0001, ""clip_q"": 0.005, ""criterion"": ""squared_error"", ""max_depth"": 48, ""max_features"": 0.7, ""min_impurity_decrease"": 0.01, ""min_samples_leaf"": 1, ""min_samples_split"": 3, ""synthetic_weight"": 0.9}",COMPLETE
66,44.1696032289525,2026-09-27 17:34:11.972389,2026-09-27 17:34:19.878510,0 days 00:00:07.906121,False,0.001,0.0005,squared_error,,0.12,,0.0,1,3,0.65,"{""bootstrap"": false, ""ccp_alpha"": 0.001, ""clip_q"": 0.0005, ""criterion"": ""squared_error"", ""max_depth"": null, ""max_features"": 0.12, ""min_impurity_decrease"": 0.0, ""min_samples_leaf"": 1, ""min_samples_split"": 3, ""synthetic_weight"": 0.65}",COMPLETE
67,66.8592921630945,2026-09-27 17:34:19.934741,2026-09-27 17:34:20.964143,0 days 00:00:01.029402,False,0.001,0.0005,squared_error,32.0,0.12,,0.0,2,3,0.0,"{""bootstrap"": false, ""ccp_alpha"": 0.001, ""clip_q"": 0.0005, ""criterion"": ""squared_error"", ""max_depth"": 32, ""max_features"": 0.12, ""min_impurity_decrease"": 0.0, ""min_samples_leaf"": 2, ""min_samples_split"": 3, ""synthetic_weight"": 0.0}",PRUNED
68,65.30587491084556,2026-09-27 17:34:21.016863,2026-09-27 17:34:54.355497,0 days 00:00:33.338634,False,0.001,0.0005,squared_error,,1.0,,1e-05,1,4,0.65,"{""bootstrap"": false, ""ccp_alpha"": 0.001, ""clip_q"": 0.0005, ""criterion"": ""squared_error"", ""max_depth"": null, ""max_features"": 1.0, ""min_impurity_decrease"": 1e-05, ""min_samples_leaf"": 1, ""min_samples_split"": 4, ""synthetic_weight"": 0.65}",PRUNED
69,45.60481179537084,2026-09-27 17:34:54.413831,2026-09-27 17:35:01.854801,0 days 00:00:07.440970,False,1e-05,0.005,squared_error,48.0,0.12,,0.01,2,4,0.2,"{""bootstrap"": false, ""ccp_alpha"": 1e-05, ""clip_q"": 0.005, ""criterion"": ""squared_error"", ""max_depth"": 48, ""max_features"": 0.12, ""min_impurity_decrease"": 0.01, ""min_samples_leaf"": 2, ""min_samples_split"": 4, ""synthetic_weight"": 0.2}",COMPLETE
