number,value,datetime_start,datetime_complete,duration,params_bootstrap,params_ccp_alpha,params_clip_q,params_criterion,params_max_depth,params_max_features,params_max_samples,params_min_impurity_decrease,params_min_samples_leaf,params_min_samples_split,params_synthetic_weight,system_attrs_tpe:relative_params:0,state
0,49.41604222952589,2026-09-27 17:56:10.140877,2026-09-27 17:56:26.553391,0 days 00:00:16.412514,False,1e-05,0.01,squared_error,40.0,0.35,,0.001,1,7,0.1,,COMPLETE
1,71.08191907402627,2026-09-27 17:56:26.608818,2026-09-27 17:57:02.759431,0 days 00:00:36.150613,False,1e-06,0.001,squared_error,24.0,1.0,,0.001,8,14,0.2,,COMPLETE
2,67.66388177969478,2026-09-27 17:57:02.814138,2026-09-27 17:57:11.239389,0 days 00:00:08.425251,True,0.001,0.01,squared_error,,1.0,0.9210347179474957,0.01,8,13,0.25,,COMPLETE
3,57.9224774029183,2026-09-27 17:57:11.293456,2026-09-27 17:57:15.108069,0 days 00:00:03.814613,False,1e-05,0.005,squared_error,40.0,sqrt,,0.01,9,8,0.2,,COMPLETE
4,49.872262510041544,2026-09-27 17:57:15.167635,2026-09-27 17:57:20.517559,0 days 00:00:05.349924,False,1e-06,0.0005,squared_error,16.0,0.12,,0.0,7,6,0.65,,COMPLETE
5,55.63425543817308,2026-09-27 17:57:20.573348,2026-09-27 17:57:31.436320,0 days 00:00:10.862972,True,0.001,0.01,squared_error,40.0,0.5,0.927424521398035,1e-05,5,20,1.0,,COMPLETE
6,64.58607880543154,2026-09-27 17:57:31.496098,2026-09-27 17:57:45.029156,0 days 00:00:13.533058,True,0.0,0.005,absolute_error,20.0,0.18,0.8568189246324989,0.0001,8,7,0.6,,COMPLETE
7,67.03804276034093,2026-09-27 17:57:45.083256,2026-09-27 17:57:47.265877,0 days 00:00:02.182621,True,0.0,0.001,squared_error,,sqrt,0.6409381782775996,0.01,8,10,0.55,,COMPLETE
8,75.6308676434426,2026-09-27 17:57:47.319722,2026-09-27 17:57:49.399865,0 days 00:00:02.080143,True,0.0001,0.005,squared_error,40.0,sqrt,0.6522833047149669,0.0,7,7,0.15,,COMPLETE
9,79.2162147659986,2026-09-27 17:57:49.453480,2026-09-27 17:57:53.384985,0 days 00:00:03.931505,True,0.0001,0.001,absolute_error,16.0,0.12,0.857270593823643,0.001,9,13,0.1,,COMPLETE
10,69.69793742656972,2026-09-27 17:57:53.440442,2026-09-27 17:57:55.592193,0 days 00:00:02.151751,True,0.0001,0.005,squared_error,,log2,0.9932524439732059,1e-05,9,13,0.4,,COMPLETE
11,48.5406837789311,2026-09-27 17:57:55.646311,2026-09-27 17:58:01.309267,0 days 00:00:05.662956,False,1e-05,0.0,squared_error,20.0,0.12,,0.0001,3,14,0.45,,COMPLETE
12,49.020386777554776,2026-09-27 17:58:01.368561,2026-09-27 17:58:17.573618,0 days 00:00:16.205057,False,1e-05,0.01,squared_error,,0.35,,0.0,2,5,0.1,"{""bootstrap"": false, ""ccp_alpha"": 1e-05, ""clip_q"": 0.01, ""criterion"": ""squared_error"", ""max_depth"": null, ""max_features"": 0.35, ""min_impurity_decrease"": 0.0, ""min_samples_leaf"": 2, ""min_samples_split"": 5, ""synthetic_weight"": 0.1}",COMPLETE
13,46.938229012344685,2026-09-27 17:58:17.631751,2026-09-27 17:58:26.346496,0 days 00:00:08.714745,False,1e-05,0.005,squared_error,20.0,0.18,,0.0,2,3,0.15,"{""bootstrap"": false, ""ccp_alpha"": 1e-05, ""clip_q"": 0.005, ""criterion"": ""squared_error"", ""max_depth"": 20, ""max_features"": 0.18, ""min_impurity_decrease"": 0.0, ""min_samples_leaf"": 2, ""min_samples_split"": 3, ""synthetic_weight"": 0.15}",COMPLETE
14,52.724604392145,2026-09-27 17:58:26.407253,2026-09-27 17:58:34.323959,0 days 00:00:07.916706,False,0.0001,0.005,squared_error,48.0,0.18,,0.0,2,19,0.15,"{""bootstrap"": false, ""ccp_alpha"": 0.0001, ""clip_q"": 0.005, ""criterion"": ""squared_error"", ""max_depth"": 48, ""max_features"": 0.18, ""min_impurity_decrease"": 0.0, ""min_samples_leaf"": 2, ""min_samples_split"": 19, ""synthetic_weight"": 0.15}",COMPLETE
15,45.555372921543,2026-09-27 17:58:34.378756,2026-09-27 17:58:40.375528,0 days 00:00:05.996772,False,1e-05,0.005,squared_error,20.0,0.12,,0.0001,1,9,0.95,"{""bootstrap"": false, ""ccp_alpha"": 1e-05, ""clip_q"": 0.005, ""criterion"": ""squared_error"", ""max_depth"": 20, ""max_features"": 0.12, ""min_impurity_decrease"": 0.0001, ""min_samples_leaf"": 1, ""min_samples_split"": 9, ""synthetic_weight"": 0.95}",COMPLETE
16,45.15508999592532,2026-09-27 17:58:40.430824,2026-09-27 17:58:48.905148,0 days 00:00:08.474324,False,1e-05,0.005,squared_error,20.0,0.18,,0.0,1,7,0.3,"{""bootstrap"": false, ""ccp_alpha"": 1e-05, ""clip_q"": 0.005, ""criterion"": ""squared_error"", ""max_depth"": 20, ""max_features"": 0.18, ""min_impurity_decrease"": 0.0, ""min_samples_leaf"": 1, ""min_samples_split"": 7, ""synthetic_weight"": 0.3}",COMPLETE
17,54.73019498290067,2026-09-27 17:58:48.959638,2026-09-27 17:58:54.912869,0 days 00:00:05.953231,False,1e-05,0.005,squared_error,48.0,0.12,,1e-05,4,2,0.05,"{""bootstrap"": false, ""ccp_alpha"": 1e-05, ""clip_q"": 0.005, ""criterion"": ""squared_error"", ""max_depth"": 48, ""max_features"": 0.12, ""min_impurity_decrease"": 1e-05, ""min_samples_leaf"": 4, ""min_samples_split"": 2, ""synthetic_weight"": 0.05}",COMPLETE
18,46.782179187514735,2026-09-27 17:58:54.968166,2026-09-27 17:59:08.936657,0 days 00:00:13.968491,False,1e-05,0.005,squared_error,20.0,0.35,,0.0,5,11,0.55,"{""bootstrap"": false, ""ccp_alpha"": 1e-05, ""clip_q"": 0.005, ""criterion"": ""squared_error"", ""max_depth"": 20, ""max_features"": 0.35, ""min_impurity_decrease"": 0.0, ""min_samples_leaf"": 5, ""min_samples_split"": 11, ""synthetic_weight"": 0.55}",COMPLETE
19,55.53397099464212,2026-09-27 17:59:08.991334,2026-09-27 17:59:12.576151,0 days 00:00:03.584817,True,1e-05,0.005,squared_error,24.0,0.12,0.7494845984272596,0.0001,1,9,0.9,"{""bootstrap"": true, ""ccp_alpha"": 1e-05, ""clip_q"": 0.005, ""criterion"": ""squared_error"", ""max_depth"": 24, ""max_features"": 0.12, ""min_impurity_decrease"": 0.0001, ""min_samples_leaf"": 1, ""min_samples_split"": 9, ""synthetic_weight"": 0.9}",COMPLETE
20,48.456890802897185,2026-09-27 17:59:12.629859,2026-09-27 17:59:16.702584,0 days 00:00:04.072725,False,0.001,0.0005,squared_error,20.0,sqrt,,0.001,3,10,0.95,"{""bootstrap"": false, ""ccp_alpha"": 0.001, ""clip_q"": 0.0005, ""criterion"": ""squared_error"", ""max_depth"": 20, ""max_features"": ""sqrt"", ""min_impurity_decrease"": 0.001, ""min_samples_leaf"": 3, ""min_samples_split"": 10, ""synthetic_weight"": 0.95}",COMPLETE
21,46.91807431850365,2026-09-27 17:59:16.756040,2026-09-27 17:59:46.489459,0 days 00:00:29.733419,False,1e-05,0.001,squared_error,20.0,0.7,,0.0001,1,9,0.95,"{""bootstrap"": false, ""ccp_alpha"": 1e-05, ""clip_q"": 0.001, ""criterion"": ""squared_error"", ""max_depth"": 20, ""max_features"": 0.7, ""min_impurity_decrease"": 0.0001, ""min_samples_leaf"": 1, ""min_samples_split"": 9, ""synthetic_weight"": 0.95}",COMPLETE
22,51.19830076396979,2026-09-27 17:59:46.543835,2026-09-27 17:59:56.022660,0 days 00:00:09.478825,False,1e-05,0.005,squared_error,20.0,0.25,,0.0,9,16,0.4,"{""bootstrap"": false, ""ccp_alpha"": 1e-05, ""clip_q"": 0.005, ""criterion"": ""squared_error"", ""max_depth"": 20, ""max_features"": 0.25, ""min_impurity_decrease"": 0.0, ""min_samples_leaf"": 9, ""min_samples_split"": 16, ""synthetic_weight"": 0.4}",COMPLETE
23,50.174458530579344,2026-09-27 17:59:56.076822,2026-09-27 18:00:09.610620,0 days 00:00:13.533798,False,1e-05,0.001,squared_error,20.0,0.35,,0.0,7,12,0.3,"{""bootstrap"": false, ""ccp_alpha"": 1e-05, ""clip_q"": 0.001, ""criterion"": ""squared_error"", ""max_depth"": 20, ""max_features"": 0.35, ""min_impurity_decrease"": 0.0, ""min_samples_leaf"": 7, ""min_samples_split"": 12, ""synthetic_weight"": 0.3}",COMPLETE
24,63.52980234903413,2026-09-27 18:00:09.671100,2026-09-27 18:00:33.021171,0 days 00:00:23.350071,False,1e-05,0.005,squared_error,16.0,1.0,,0.0001,4,10,0.95,"{""bootstrap"": false, ""ccp_alpha"": 1e-05, ""clip_q"": 0.005, ""criterion"": ""squared_error"", ""max_depth"": 16, ""max_features"": 1.0, ""min_impurity_decrease"": 0.0001, ""min_samples_leaf"": 4, ""min_samples_split"": 10, ""synthetic_weight"": 0.95}",PRUNED
25,49.82239798834978,2026-09-27 18:00:33.075980,2026-09-27 18:01:01.328423,0 days 00:00:28.252443,False,1e-05,0.005,absolute_error,20.0,0.12,,1e-05,1,8,0.8,"{""bootstrap"": false, ""ccp_alpha"": 1e-05, ""clip_q"": 0.005, ""criterion"": ""absolute_error"", ""max_depth"": 20, ""max_features"": 0.12, ""min_impurity_decrease"": 1e-05, ""min_samples_leaf"": 1, ""min_samples_split"": 8, ""synthetic_weight"": 0.8}",COMPLETE
26,47.90509920984973,2026-09-27 18:01:01.387336,2026-09-27 18:01:07.253793,0 days 00:00:05.866457,False,1e-05,0.0005,squared_error,16.0,0.12,,0.0001,3,4,0.25,"{""bootstrap"": false, ""ccp_alpha"": 1e-05, ""clip_q"": 0.0005, ""criterion"": ""squared_error"", ""max_depth"": 16, ""max_features"": 0.12, ""min_impurity_decrease"": 0.0001, ""min_samples_leaf"": 3, ""min_samples_split"": 4, ""synthetic_weight"": 0.25}",COMPLETE
27,47.14915012601664,2026-09-27 18:01:07.308309,2026-09-27 18:01:17.815540,0 days 00:00:10.507231,False,0.0001,0.005,squared_error,20.0,0.25,,0.0,4,9,0.3,"{""bootstrap"": false, ""ccp_alpha"": 0.0001, ""clip_q"": 0.005, ""criterion"": ""squared_error"", ""max_depth"": 20, ""max_features"": 0.25, ""min_impurity_decrease"": 0.0, ""min_samples_leaf"": 4, ""min_samples_split"": 9, ""synthetic_weight"": 0.3}",COMPLETE
28,55.55008756810782,2026-09-27 18:01:17.876754,2026-09-27 18:01:25.828994,0 days 00:00:07.952240,False,1e-05,0.005,squared_error,12.0,0.35,,0.0,2,14,0.1,"{""bootstrap"": false, ""ccp_alpha"": 1e-05, ""clip_q"": 0.005, ""criterion"": ""squared_error"", ""max_depth"": 12, ""max_features"": 0.35, ""min_impurity_decrease"": 0.0, ""min_samples_leaf"": 2, ""min_samples_split"": 14, ""synthetic_weight"": 0.1}",PRUNED
29,48.76286444342775,2026-09-27 18:01:25.882858,2026-09-27 18:02:04.104494,0 days 00:00:38.221636,False,1e-05,0.0005,absolute_error,20.0,0.18,,0.01,2,6,0.9,"{""bootstrap"": false, ""ccp_alpha"": 1e-05, ""clip_q"": 0.0005, ""criterion"": ""absolute_error"", ""max_depth"": 20, ""max_features"": 0.18, ""min_impurity_decrease"": 0.01, ""min_samples_leaf"": 2, ""min_samples_split"": 6, ""synthetic_weight"": 0.9}",COMPLETE
30,51.29533104568486,2026-09-27 18:02:04.164575,2026-09-27 18:02:14.881894,0 days 00:00:10.717319,False,1e-05,0.01,squared_error,20.0,0.5,,0.0,10,6,0.55,"{""bootstrap"": false, ""ccp_alpha"": 1e-05, ""clip_q"": 0.01, ""criterion"": ""squared_error"", ""max_depth"": 20, ""max_features"": 0.5, ""min_impurity_decrease"": 0.0, ""min_samples_leaf"": 10, ""min_samples_split"": 6, ""synthetic_weight"": 0.55}",PRUNED
31,47.03782127839508,2026-09-27 18:02:14.937178,2026-09-27 18:02:45.964964,0 days 00:00:31.027786,False,1e-06,0.001,squared_error,48.0,0.7,,0.0001,1,6,0.8,"{""bootstrap"": false, ""ccp_alpha"": 1e-06, ""clip_q"": 0.001, ""criterion"": ""squared_error"", ""max_depth"": 48, ""max_features"": 0.7, ""min_impurity_decrease"": 0.0001, ""min_samples_leaf"": 1, ""min_samples_split"": 6, ""synthetic_weight"": 0.8}",COMPLETE
32,46.16009092572095,2026-09-27 18:02:46.019405,2026-09-27 18:03:15.431627,0 days 00:00:29.412222,False,1e-05,0.001,squared_error,20.0,0.7,,1e-05,3,6,0.95,"{""bootstrap"": false, ""ccp_alpha"": 1e-05, ""clip_q"": 0.001, ""criterion"": ""squared_error"", ""max_depth"": 20, ""max_features"": 0.7, ""min_impurity_decrease"": 1e-05, ""min_samples_leaf"": 3, ""min_samples_split"": 6, ""synthetic_weight"": 0.95}",COMPLETE
33,48.44442143676902,2026-09-27 18:03:15.485228,2026-09-27 18:03:22.841967,0 days 00:00:07.356739,False,1e-05,0.005,squared_error,12.0,0.18,,0.01,1,8,0.55,"{""bootstrap"": false, ""ccp_alpha"": 1e-05, ""clip_q"": 0.005, ""criterion"": ""squared_error"", ""max_depth"": 12, ""max_features"": 0.18, ""min_impurity_decrease"": 0.01, ""min_samples_leaf"": 1, ""min_samples_split"": 8, ""synthetic_weight"": 0.55}",COMPLETE
34,54.547424573326474,2026-09-27 18:03:22.896992,2026-09-27 18:04:46.598880,0 days 00:01:23.701888,False,1e-05,0.001,absolute_error,20.0,0.7,,1e-05,3,3,0.7,"{""bootstrap"": false, ""ccp_alpha"": 1e-05, ""clip_q"": 0.001, ""criterion"": ""absolute_error"", ""max_depth"": 20, ""max_features"": 0.7, ""min_impurity_decrease"": 1e-05, ""min_samples_leaf"": 3, ""min_samples_split"": 3, ""synthetic_weight"": 0.7}",PRUNED
35,46.53336482986841,2026-09-27 18:04:46.652671,2026-09-27 18:04:54.252337,0 days 00:00:07.599666,False,0.0,0.005,squared_error,20.0,0.18,,0.0,4,12,0.55,"{""bootstrap"": false, ""ccp_alpha"": 0.0, ""clip_q"": 0.005, ""criterion"": ""squared_error"", ""max_depth"": 20, ""max_features"": 0.18, ""min_impurity_decrease"": 0.0, ""min_samples_leaf"": 4, ""min_samples_split"": 12, ""synthetic_weight"": 0.55}",COMPLETE
36,47.80627569983817,2026-09-27 18:04:54.306995,2026-09-27 18:05:01.802139,0 days 00:00:07.495144,False,0.0,0.005,squared_error,20.0,0.18,,0.0,6,8,0.6,"{""bootstrap"": false, ""ccp_alpha"": 0.0, ""clip_q"": 0.005, ""criterion"": ""squared_error"", ""max_depth"": 20, ""max_features"": 0.18, ""min_impurity_decrease"": 0.0, ""min_samples_leaf"": 6, ""min_samples_split"": 8, ""synthetic_weight"": 0.6}",COMPLETE
37,59.090945209280086,2026-09-27 18:05:01.859479,2026-09-27 18:05:04.834552,0 days 00:00:02.975073,True,0.0,0.005,squared_error,20.0,0.35,0.7343041209350628,0.0,3,19,0.55,"{""bootstrap"": true, ""ccp_alpha"": 0.0, ""clip_q"": 0.005, ""criterion"": ""squared_error"", ""max_depth"": 20, ""max_features"": 0.35, ""min_impurity_decrease"": 0.0, ""min_samples_leaf"": 3, ""min_samples_split"": 19, ""synthetic_weight"": 0.55}",PRUNED
38,46.78088490270086,2026-09-27 18:05:04.888333,2026-09-27 18:05:33.066495,0 days 00:00:28.178162,False,1e-05,0.001,squared_error,20.0,0.7,,0.0001,4,7,0.95,"{""bootstrap"": false, ""ccp_alpha"": 1e-05, ""clip_q"": 0.001, ""criterion"": ""squared_error"", ""max_depth"": 20, ""max_features"": 0.7, ""min_impurity_decrease"": 0.0001, ""min_samples_leaf"": 4, ""min_samples_split"": 7, ""synthetic_weight"": 0.95}",COMPLETE
39,54.494871362229524,2026-09-27 18:05:33.120350,2026-09-27 18:06:11.137363,0 days 00:00:38.017013,False,1e-05,0.005,absolute_error,20.0,0.18,,0.0,2,11,0.3,"{""bootstrap"": false, ""ccp_alpha"": 1e-05, ""clip_q"": 0.005, ""criterion"": ""absolute_error"", ""max_depth"": 20, ""max_features"": 0.18, ""min_impurity_decrease"": 0.0, ""min_samples_leaf"": 2, ""min_samples_split"": 11, ""synthetic_weight"": 0.3}",COMPLETE
40,67.01352364165002,2026-09-27 18:06:11.196408,2026-09-27 18:06:35.219980,0 days 00:00:24.023572,False,1e-05,0.005,squared_error,20.0,1.0,,0.0001,2,17,0.95,"{""bootstrap"": false, ""ccp_alpha"": 1e-05, ""clip_q"": 0.005, ""criterion"": ""squared_error"", ""max_depth"": 20, ""max_features"": 1.0, ""min_impurity_decrease"": 0.0001, ""min_samples_leaf"": 2, ""min_samples_split"": 17, ""synthetic_weight"": 0.95}",PRUNED
41,51.40863906218892,2026-09-27 18:06:35.279769,2026-09-27 18:06:37.054053,0 days 00:00:01.774284,False,1e-05,0.01,squared_error,20.0,log2,,1e-05,4,5,0.95,"{""bootstrap"": false, ""ccp_alpha"": 1e-05, ""clip_q"": 0.01, ""criterion"": ""squared_error"", ""max_depth"": 20, ""max_features"": ""log2"", ""min_impurity_decrease"": 1e-05, ""min_samples_leaf"": 4, ""min_samples_split"": 5, ""synthetic_weight"": 0.95}",PRUNED
42,52.20445043889523,2026-09-27 18:06:37.110630,2026-09-27 18:06:53.650380,0 days 00:00:16.539750,False,1e-05,0.001,squared_error,20.0,0.7,,0.0001,5,7,0.35,"{""bootstrap"": false, ""ccp_alpha"": 1e-05, ""clip_q"": 0.001, ""criterion"": ""squared_error"", ""max_depth"": 20, ""max_features"": 0.7, ""min_impurity_decrease"": 0.0001, ""min_samples_leaf"": 5, ""min_samples_split"": 7, ""synthetic_weight"": 0.35}",PRUNED
43,48.81515598374103,2026-09-27 18:06:53.711026,2026-09-27 18:07:01.050667,0 days 00:00:07.339641,False,0.0,0.005,squared_error,16.0,0.18,,0.0,6,16,0.65,"{""bootstrap"": false, ""ccp_alpha"": 0.0, ""clip_q"": 0.005, ""criterion"": ""squared_error"", ""max_depth"": 16, ""max_features"": 0.18, ""min_impurity_decrease"": 0.0, ""min_samples_leaf"": 6, ""min_samples_split"": 16, ""synthetic_weight"": 0.65}",COMPLETE
44,50.02236048716705,2026-09-27 18:07:01.109729,2026-09-27 18:07:09.052059,0 days 00:00:07.942330,False,0.0,0.005,squared_error,20.0,0.18,,0.0,3,12,0.15,"{""bootstrap"": false, ""ccp_alpha"": 0.0, ""clip_q"": 0.005, ""criterion"": ""squared_error"", ""max_depth"": 20, ""max_features"": 0.18, ""min_impurity_decrease"": 0.0, ""min_samples_leaf"": 3, ""min_samples_split"": 12, ""synthetic_weight"": 0.15}",COMPLETE
45,46.692631505111436,2026-09-27 18:07:09.106785,2026-09-27 18:07:13.408738,0 days 00:00:04.301953,False,1e-05,0.0005,squared_error,20.0,sqrt,,0.001,1,7,0.95,"{""bootstrap"": false, ""ccp_alpha"": 1e-05, ""clip_q"": 0.0005, ""criterion"": ""squared_error"", ""max_depth"": 20, ""max_features"": ""sqrt"", ""min_impurity_decrease"": 0.001, ""min_samples_leaf"": 1, ""min_samples_split"": 7, ""synthetic_weight"": 0.95}",COMPLETE
46,45.460852438270294,2026-09-27 18:07:13.464174,2026-09-27 18:07:21.952224,0 days 00:00:08.488050,False,1e-05,0.0025,squared_error,20.0,0.18,,0.001,1,8,0.3,"{""bootstrap"": false, ""ccp_alpha"": 1e-05, ""clip_q"": 0.0025, ""criterion"": ""squared_error"", ""max_depth"": 20, ""max_features"": 0.18, ""min_impurity_decrease"": 0.001, ""min_samples_leaf"": 1, ""min_samples_split"": 8, ""synthetic_weight"": 0.3}",COMPLETE
47,45.91690264123607,2026-09-27 18:07:22.012391,2026-09-27 18:07:27.846721,0 days 00:00:05.834330,False,0.0001,0.01,squared_error,40.0,0.12,,0.0001,3,9,0.95,"{""bootstrap"": false, ""ccp_alpha"": 0.0001, ""clip_q"": 0.01, ""criterion"": ""squared_error"", ""max_depth"": 40, ""max_features"": 0.12, ""min_impurity_decrease"": 0.0001, ""min_samples_leaf"": 3, ""min_samples_split"": 9, ""synthetic_weight"": 0.95}",COMPLETE
48,46.75661575881531,2026-09-27 18:07:27.907033,2026-09-27 18:07:36.071077,0 days 00:00:08.164044,False,0.0,0.0025,squared_error,20.0,0.18,,0.001,2,10,0.3,"{""bootstrap"": false, ""ccp_alpha"": 0.0, ""clip_q"": 0.0025, ""criterion"": ""squared_error"", ""max_depth"": 20, ""max_features"": 0.18, ""min_impurity_decrease"": 0.001, ""min_samples_leaf"": 2, ""min_samples_split"": 10, ""synthetic_weight"": 0.3}",COMPLETE
49,62.27634330836747,2026-09-27 18:07:36.131719,2026-09-27 18:07:37.864799,0 days 00:00:01.733080,True,0.001,0.0025,squared_error,20.0,0.18,0.7306725337446016,0.001,4,9,0.3,"{""bootstrap"": true, ""ccp_alpha"": 0.001, ""clip_q"": 0.0025, ""criterion"": ""squared_error"", ""max_depth"": 20, ""max_features"": 0.18, ""min_impurity_decrease"": 0.001, ""min_samples_leaf"": 4, ""min_samples_split"": 9, ""synthetic_weight"": 0.3}",PRUNED
50,44.619937829527835,2026-09-27 18:07:37.925985,2026-09-27 18:07:46.045832,0 days 00:00:08.119847,False,0.0001,0.01,squared_error,24.0,0.18,,0.0001,3,7,0.95,"{""bootstrap"": false, ""ccp_alpha"": 0.0001, ""clip_q"": 0.01, ""criterion"": ""squared_error"", ""max_depth"": 24, ""max_features"": 0.18, ""min_impurity_decrease"": 0.0001, ""min_samples_leaf"": 3, ""min_samples_split"": 7, ""synthetic_weight"": 0.95}",COMPLETE
51,43.99939185031598,2026-09-27 18:07:46.101979,2026-09-27 18:07:54.471569,0 days 00:00:08.369590,False,1e-06,0.0005,squared_error,24.0,0.18,,0.0001,2,6,0.95,"{""bootstrap"": false, ""ccp_alpha"": 1e-06, ""clip_q"": 0.0005, ""criterion"": ""squared_error"", ""max_depth"": 24, ""max_features"": 0.18, ""min_impurity_decrease"": 0.0001, ""min_samples_leaf"": 2, ""min_samples_split"": 6, ""synthetic_weight"": 0.95}",COMPLETE
52,44.024598787713856,2026-09-27 18:07:54.533173,2026-09-27 18:08:02.816948,0 days 00:00:08.283775,False,0.0,0.0005,squared_error,24.0,0.18,,0.0001,2,7,0.95,"{""bootstrap"": false, ""ccp_alpha"": 0.0, ""clip_q"": 0.0005, ""criterion"": ""squared_error"", ""max_depth"": 24, ""max_features"": 0.18, ""min_impurity_decrease"": 0.0001, ""min_samples_leaf"": 2, ""min_samples_split"": 7, ""synthetic_weight"": 0.95}",COMPLETE
53,45.85682335001936,2026-09-27 18:08:02.871666,2026-09-27 18:08:11.187913,0 days 00:00:08.316247,False,0.0001,0.0025,squared_error,20.0,0.18,,0.001,2,7,0.3,"{""bootstrap"": false, ""ccp_alpha"": 0.0001, ""clip_q"": 0.0025, ""criterion"": ""squared_error"", ""max_depth"": 20, ""max_features"": 0.18, ""min_impurity_decrease"": 0.001, ""min_samples_leaf"": 2, ""min_samples_split"": 7, ""synthetic_weight"": 0.3}",COMPLETE
54,46.85525711460351,2026-09-27 18:08:11.242764,2026-09-27 18:08:19.199272,0 days 00:00:07.956508,False,0.0,0.0005,squared_error,24.0,0.18,,0.0001,3,9,0.3,"{""bootstrap"": false, ""ccp_alpha"": 0.0, ""clip_q"": 0.0005, ""criterion"": ""squared_error"", ""max_depth"": 24, ""max_features"": 0.18, ""min_impurity_decrease"": 0.0001, ""min_samples_leaf"": 3, ""min_samples_split"": 9, ""synthetic_weight"": 0.3}",COMPLETE
55,45.26708296689278,2026-09-27 18:08:19.253336,2026-09-27 18:08:27.745317,0 days 00:00:08.491981,False,0.0,0.005,squared_error,20.0,0.18,,0.0001,1,6,0.3,"{""bootstrap"": false, ""ccp_alpha"": 0.0, ""clip_q"": 0.005, ""criterion"": ""squared_error"", ""max_depth"": 20, ""max_features"": 0.18, ""min_impurity_decrease"": 0.0001, ""min_samples_leaf"": 1, ""min_samples_split"": 6, ""synthetic_weight"": 0.3}",COMPLETE
56,47.44627759800318,2026-09-27 18:08:27.800592,2026-09-27 18:08:32.268685,0 days 00:00:04.468093,False,0.0,0.005,squared_error,20.0,0.08,,0.0001,1,5,0.3,"{""bootstrap"": false, ""ccp_alpha"": 0.0, ""clip_q"": 0.005, ""criterion"": ""squared_error"", ""max_depth"": 20, ""max_features"": 0.08, ""min_impurity_decrease"": 0.0001, ""min_samples_leaf"": 1, ""min_samples_split"": 5, ""synthetic_weight"": 0.3}",COMPLETE
