number,value,datetime_start,datetime_complete,duration,params_batch_size,params_bidirectional,params_clip_q,params_fusion_hidden,params_grad_clip,params_hidden_size,params_history_steps,params_huber_beta,params_learning_rate,params_mlp_dropout,params_num_layers,params_rnn_dropout,params_rnn_type,params_synthetic_weight,params_tabular_hidden,params_weight_decay,system_attrs_fixed_params,system_attrs_tpe:relative_params:0,state
0,33.63900709939084,2026-09-27 07:17:10.413566,2026-09-27 07:25:16.236768,0 days 00:08:05.823202,64,True,q999,128,1.0,96,20,0.5,0.0011759850889109282,0.12180844304622718,3,0.14337466550235295,LSTM,0.75,64,0.00014021027621985056,"{'num_layers': 3, 'rnn_type': 'LSTM', 'history_steps': 20, 'hidden_size': 96, 'bidirectional': True, 'rnn_dropout': 0.14337466550235295, 'tabular_hidden': 64, 'fusion_hidden': 128, 'mlp_dropout': 0.12180844304622718, 'learning_rate': 0.0011759850889109282, 'weight_decay': 0.00014021027621985056, 'batch_size': 64, 'huber_beta': 0.5, 'grad_clip': 1.0, 'synthetic_weight': 0.75, 'clip_q': 'q999'}",,COMPLETE
1,32.658697375508126,2026-09-27 07:25:16.377558,2026-09-27 07:37:31.742184,0 days 00:12:15.364626,64,True,q999,64,1.0,96,20,0.5,0.0008229421352700022,0.12630777354553704,3,0.24371820172525102,LSTM,0.75,96,6.0523233100781254e-05,,,COMPLETE
2,49.389342419563626,2026-09-27 07:37:31.971292,2026-09-27 07:45:23.285062,0 days 00:07:51.313770,64,False,q999,128,2.0,32,20,0.25,0.0003603498355153184,0.08026102244753223,1,,LSTM,0.25,192,0.0015038271491457477,,,COMPLETE
3,74.41409520127728,2026-09-27 07:45:23.537847,2026-09-27 07:46:13.514535,0 days 00:00:49.976688,128,False,none,192,0.5,64,15,1.0,0.0009381645298896862,0.22308689357169043,3,0.2213747861383773,GRU,0.0,96,0.006718390446089726,,,COMPLETE
4,61.52861562893601,2026-09-27 07:46:13.733109,2026-09-27 07:54:20.924819,0 days 00:08:07.191710,64,False,none,96,2.0,32,20,1.0,0.00012421733228319676,0.09739390506264511,2,0.22649172042811574,LSTM,0.1,192,0.0001264936003269507,,,COMPLETE
5,73.56383538381644,2026-09-27 07:54:21.142492,2026-09-27 07:54:34.729146,0 days 00:00:13.586654,256,True,q995,96,5.0,32,10,0.5,0.00046926239163901096,0.42845247742639964,2,0.09656845360928862,GRU,0.0,128,5.116819219852885e-06,,,PRUNED
6,42.00723041504172,2026-09-27 07:54:34.986560,2026-09-27 07:58:26.104681,0 days 00:03:51.118121,192,False,q999,192,1.0,48,15,1.0,0.0008144571295603401,0.2374622810280732,2,0.08444756241288043,LSTM,0.5,192,0.00021870901732297512,,,COMPLETE
7,51.46130773261994,2026-09-27 07:58:26.315131,2026-09-27 08:08:40.088588,0 days 00:10:13.773457,128,True,none,96,0.5,48,20,0.25,0.00023807498862760706,0.25991700909544174,3,0.34854803124425826,GRU,1.0,64,0.014300413056654434,,,PRUNED
8,46.55010434202593,2026-09-27 08:08:40.258991,2026-09-27 08:19:18.303992,0 days 00:10:38.045001,64,True,q995,192,2.0,96,15,0.25,0.0007409419004418181,0.31392784686172276,1,,LSTM,0.25,64,0.021732544561887154,,,COMPLETE
9,56.79723195481246,2026-09-27 08:19:18.503315,2026-09-27 08:23:00.964806,0 days 00:03:42.461491,128,False,q999,64,5.0,64,15,0.25,0.00011590691871290111,0.35798310914854986,3,0.16384000052881564,LSTM,1.0,64,0.0001578719425714864,,,PRUNED
10,36.80014259545376,2026-09-27 08:23:01.172789,2026-09-27 08:36:05.774656,0 days 00:13:04.601867,64,True,q999,64,1.0,128,20,0.5,0.0006184067284511305,0.28288491606179705,3,0.008602880937228774,LSTM,0.25,192,3.1233408857425347e-06,,"{""batch_size"": 64, ""bidirectional"": true, ""clip_q"": ""q999"", ""fusion_hidden"": 64, ""grad_clip"": 1.0, ""hidden_size"": 128, ""history_steps"": 20, ""huber_beta"": 0.5, ""learning_rate"": 0.0006184067284511305, ""mlp_dropout"": 0.28288491606179705, ""num_layers"": 3, ""rnn_type"": ""LSTM"", ""synthetic_weight"": 0.25, ""tabular_hidden"": 192, ""weight_decay"": 3.1233408857425347e-06}",COMPLETE
11,33.925800385446955,2026-09-27 08:36:05.921930,2026-09-27 08:46:26.074428,0 days 00:10:20.152498,64,True,q999,192,1.0,96,20,0.5,0.0013510341951562224,0.15335682379294974,2,0.3175334516393728,LSTM,0.5,96,0.00035787075139255564,,"{""batch_size"": 64, ""bidirectional"": true, ""clip_q"": ""q999"", ""fusion_hidden"": 192, ""grad_clip"": 1.0, ""hidden_size"": 96, ""history_steps"": 20, ""huber_beta"": 0.5, ""learning_rate"": 0.0013510341951562224, ""mlp_dropout"": 0.15335682379294974, ""num_layers"": 2, ""rnn_type"": ""LSTM"", ""synthetic_weight"": 0.5, ""tabular_hidden"": 96, ""weight_decay"": 0.00035787075139255564}",COMPLETE
12,36.777404229420966,2026-09-27 08:46:26.248991,2026-09-27 08:59:11.335859,0 days 00:12:45.086868,64,True,q999,64,1.0,96,20,0.25,0.00032639676288050325,0.07964399941296244,3,0.2595884440623496,LSTM,0.75,128,0.00048755797639704254,,"{""batch_size"": 64, ""bidirectional"": true, ""clip_q"": ""q999"", ""fusion_hidden"": 64, ""grad_clip"": 1.0, ""hidden_size"": 96, ""history_steps"": 20, ""huber_beta"": 0.25, ""learning_rate"": 0.00032639676288050325, ""mlp_dropout"": 0.07964399941296244, ""num_layers"": 3, ""rnn_type"": ""LSTM"", ""synthetic_weight"": 0.75, ""tabular_hidden"": 128, ""weight_decay"": 0.00048755797639704254}",COMPLETE
13,35.6215515901327,2026-09-27 08:59:11.432664,2026-09-27 09:06:25.916622,0 days 00:07:14.483958,128,True,q999,128,1.0,96,15,0.5,0.0006623481056177475,0.2155900330126109,3,0.15113445556860974,GRU,0.75,64,0.00013005756192869833,,"{""batch_size"": 128, ""bidirectional"": true, ""clip_q"": ""q999"", ""fusion_hidden"": 128, ""grad_clip"": 1.0, ""hidden_size"": 96, ""history_steps"": 15, ""huber_beta"": 0.5, ""learning_rate"": 0.0006623481056177475, ""mlp_dropout"": 0.2155900330126109, ""num_layers"": 3, ""rnn_type"": ""GRU"", ""synthetic_weight"": 0.75, ""tabular_hidden"": 64, ""weight_decay"": 0.00013005756192869833}",COMPLETE
14,72.79741937711034,2026-09-27 09:06:26.010951,2026-09-27 09:06:32.821409,0 days 00:00:06.810458,64,False,q999,128,2.0,96,20,0.5,0.0018769693864093635,0.11761720107205455,3,0.39029781435080924,LSTM,0.0,64,4.131685167658293e-05,,"{""batch_size"": 64, ""bidirectional"": false, ""clip_q"": ""q999"", ""fusion_hidden"": 128, ""grad_clip"": 2.0, ""hidden_size"": 96, ""history_steps"": 20, ""huber_beta"": 0.5, ""learning_rate"": 0.0018769693864093635, ""mlp_dropout"": 0.11761720107205455, ""num_layers"": 3, ""rnn_type"": ""LSTM"", ""synthetic_weight"": 0.0, ""tabular_hidden"": 64, ""weight_decay"": 4.131685167658293e-05}",PRUNED
