number,value,datetime_start,datetime_complete,duration,params_batch_size,params_bidirectional,params_clip_q,params_fusion_hidden,params_grad_clip,params_hidden_size,params_history_steps,params_huber_beta,params_learning_rate,params_mlp_dropout,params_num_layers,params_rnn_dropout,params_rnn_type,params_synthetic_weight,params_tabular_hidden,params_weight_decay,system_attrs_tpe:relative_params:0,state
0,35.364992620027685,2026-09-27 04:40:40.598721,2026-09-27 04:48:58.479798,0 days 00:08:17.881077,64,True,q999,64,1.0,96,20,0.5,0.0008229421352700022,0.12630777354553704,3,0.24371820172525102,LSTM,0.75,96,6.0523233100781254e-05,,COMPLETE
1,48.6846317788718,2026-09-27 04:48:58.704169,2026-09-27 04:52:55.017669,0 days 00:03:56.313500,64,False,q999,128,2.0,32,20,0.25,0.0003603498355153184,0.08026102244753223,1,,LSTM,0.25,192,0.0015038271491457477,,COMPLETE
2,77.80639241405608,2026-09-27 04:52:55.265161,2026-09-27 04:53:22.312062,0 days 00:00:27.046901,128,False,none,192,0.5,64,15,1.0,0.0009381645298896862,0.22308689357169043,3,0.2213747861383773,GRU,0.0,96,0.006718390446089726,,COMPLETE
3,53.40479802649819,2026-09-27 04:53:22.562649,2026-09-27 05:00:30.111061,0 days 00:07:07.548412,64,False,none,96,2.0,32,20,1.0,0.00012421733228319676,0.09739390506264511,2,0.22649172042811574,LSTM,0.1,192,0.0001264936003269507,,COMPLETE
4,78.18999817238154,2026-09-27 05:00:30.266841,2026-09-27 05:00:47.661245,0 days 00:00:17.394404,256,True,q995,96,5.0,32,10,0.5,0.00046926239163901096,0.42845247742639964,2,0.09656845360928862,GRU,0.0,128,5.116819219852885e-06,,COMPLETE
5,42.05254356350302,2026-09-27 05:00:47.876284,2026-09-27 05:02:57.608049,0 days 00:02:09.731765,192,False,q999,192,1.0,48,15,1.0,0.0008144571295603401,0.2374622810280732,2,0.08444756241288043,LSTM,0.5,192,0.00021870901732297512,,COMPLETE
6,47.43229668119137,2026-09-27 05:02:57.784784,2026-09-27 05:13:53.212897,0 days 00:10:55.428113,128,True,none,96,0.5,48,20,0.25,0.00023807498862760706,0.25991700909544174,3,0.34854803124425826,GRU,1.0,64,0.014300413056654434,,COMPLETE
7,46.538496160782444,2026-09-27 05:13:53.366416,2026-09-27 05:18:39.465915,0 days 00:04:46.099499,64,True,q995,192,2.0,96,15,0.25,0.0007409419004418181,0.31392784686172276,1,,LSTM,0.25,64,0.021732544561887154,,COMPLETE
8,52.37327742989217,2026-09-27 05:18:39.686107,2026-09-27 05:21:26.004739,0 days 00:02:46.318632,128,False,q999,64,5.0,64,15,0.25,0.00011590691871290111,0.35798310914854986,3,0.16384000052881564,LSTM,1.0,64,0.0001578719425714864,,PRUNED
9,52.985812708356576,2026-09-27 05:21:26.204610,2026-09-27 05:22:34.568904,0 days 00:01:08.364294,192,False,q995,192,0.5,64,10,0.25,0.00022394973042252905,0.1454007345708969,1,,LSTM,0.5,64,0.0025035783231522287,,PRUNED
10,39.33336992907096,2026-09-27 05:22:34.768857,2026-09-27 05:31:17.980620,0 days 00:08:43.211763,64,True,q999,64,1.0,128,20,0.5,0.0006184067284511305,0.28288491606179705,3,0.3934881414895832,LSTM,0.25,192,3.1233408857425347e-06,"{""batch_size"": 64, ""bidirectional"": true, ""clip_q"": ""q999"", ""fusion_hidden"": 64, ""grad_clip"": 1.0, ""hidden_size"": 128, ""history_steps"": 20, ""huber_beta"": 0.5, ""learning_rate"": 0.0006184067284511305, ""mlp_dropout"": 0.28288491606179705, ""num_layers"": 3, ""rnn_type"": ""LSTM"", ""synthetic_weight"": 0.25, ""tabular_hidden"": 192, ""weight_decay"": 3.1233408857425347e-06}",COMPLETE
11,36.20692440198993,2026-09-27 05:31:18.206017,2026-09-27 05:38:18.233160,0 days 00:07:00.027143,64,True,q999,64,1.0,96,20,1.0,0.0025460081136878996,0.27613042209269434,2,0.39726240610790264,LSTM,0.75,256,3.812216172637749e-05,"{""batch_size"": 64, ""bidirectional"": true, ""clip_q"": ""q999"", ""fusion_hidden"": 64, ""grad_clip"": 1.0, ""hidden_size"": 96, ""history_steps"": 20, ""huber_beta"": 1.0, ""learning_rate"": 0.0025460081136878996, ""mlp_dropout"": 0.27613042209269434, ""num_layers"": 2, ""rnn_type"": ""LSTM"", ""synthetic_weight"": 0.75, ""tabular_hidden"": 256, ""weight_decay"": 3.812216172637749e-05}",COMPLETE
12,38.167880563411195,2026-09-27 05:38:18.437316,2026-09-27 05:40:36.455614,0 days 00:02:18.018298,256,True,q999,64,1.0,96,20,0.5,0.0006707586430164437,0.15821277382701304,2,0.30500000154985085,LSTM,0.75,96,0.0002041338137543972,"{""batch_size"": 256, ""bidirectional"": true, ""clip_q"": ""q999"", ""fusion_hidden"": 64, ""grad_clip"": 1.0, ""hidden_size"": 96, ""history_steps"": 20, ""huber_beta"": 0.5, ""learning_rate"": 0.0006707586430164437, ""mlp_dropout"": 0.15821277382701304, ""num_layers"": 2, ""rnn_type"": ""LSTM"", ""synthetic_weight"": 0.75, ""tabular_hidden"": 96, ""weight_decay"": 0.0002041338137543972}",COMPLETE
13,39.51496228855736,2026-09-27 05:40:36.652616,2026-09-27 05:46:42.942134,0 days 00:06:06.289518,64,True,q999,64,1.0,96,20,1.0,0.00039435863696626097,0.20176471994638445,1,,LSTM,0.75,256,5.923987007450404e-06,"{""batch_size"": 64, ""bidirectional"": true, ""clip_q"": ""q999"", ""fusion_hidden"": 64, ""grad_clip"": 1.0, ""hidden_size"": 96, ""history_steps"": 20, ""huber_beta"": 1.0, ""learning_rate"": 0.00039435863696626097, ""mlp_dropout"": 0.20176471994638445, ""num_layers"": 1, ""rnn_type"": ""LSTM"", ""synthetic_weight"": 0.75, ""tabular_hidden"": 256, ""weight_decay"": 5.923987007450404e-06}",COMPLETE
14,69.6408330360843,2026-09-27 05:46:43.177695,2026-09-27 05:47:20.877600,0 days 00:00:37.699905,64,True,q999,64,1.0,96,20,1.0,0.0017464020245688036,0.2782636573228457,3,0.0033479867593315116,GRU,0.0,256,9.082333954165045e-05,"{""batch_size"": 64, ""bidirectional"": true, ""clip_q"": ""q999"", ""fusion_hidden"": 64, ""grad_clip"": 1.0, ""hidden_size"": 96, ""history_steps"": 20, ""huber_beta"": 1.0, ""learning_rate"": 0.0017464020245688036, ""mlp_dropout"": 0.2782636573228457, ""num_layers"": 3, ""rnn_type"": ""GRU"", ""synthetic_weight"": 0.0, ""tabular_hidden"": 256, ""weight_decay"": 9.082333954165045e-05}",PRUNED
15,44.580054532916215,2026-09-27 05:47:21.056468,2026-09-27 05:54:35.973433,0 days 00:07:14.916965,64,True,q999,64,1.0,64,20,1.0,0.002639905412315597,0.39150354893479167,2,0.2881898397025523,LSTM,0.1,256,0.0001964882858949571,"{""batch_size"": 64, ""bidirectional"": true, ""clip_q"": ""q999"", ""fusion_hidden"": 64, ""grad_clip"": 1.0, ""hidden_size"": 64, ""history_steps"": 20, ""huber_beta"": 1.0, ""learning_rate"": 0.002639905412315597, ""mlp_dropout"": 0.39150354893479167, ""num_layers"": 2, ""rnn_type"": ""LSTM"", ""synthetic_weight"": 0.1, ""tabular_hidden"": 256, ""weight_decay"": 0.0001964882858949571}",COMPLETE
16,38.479595499331396,2026-09-27 05:54:36.201325,2026-09-27 06:01:40.278373,0 days 00:07:04.077048,64,True,q999,64,1.0,96,30,0.25,0.002135215477956219,0.0891575890123906,2,0.24662583418647038,LSTM,0.75,256,3.3062183810238734e-05,"{""batch_size"": 64, ""bidirectional"": true, ""clip_q"": ""q999"", ""fusion_hidden"": 64, ""grad_clip"": 1.0, ""hidden_size"": 96, ""history_steps"": 30, ""huber_beta"": 0.25, ""learning_rate"": 0.002135215477956219, ""mlp_dropout"": 0.0891575890123906, ""num_layers"": 2, ""rnn_type"": ""LSTM"", ""synthetic_weight"": 0.75, ""tabular_hidden"": 256, ""weight_decay"": 3.3062183810238734e-05}",COMPLETE
17,51.47200017518992,2026-09-27 06:01:40.480191,2026-09-27 06:05:38.839808,0 days 00:03:58.359617,96,True,q999,128,1.0,96,20,1.0,0.0012178148984621682,0.3990182112985824,2,0.39390784182842725,LSTM,0.1,96,5.963696676349595e-06,"{""batch_size"": 96, ""bidirectional"": true, ""clip_q"": ""q999"", ""fusion_hidden"": 128, ""grad_clip"": 1.0, ""hidden_size"": 96, ""history_steps"": 20, ""huber_beta"": 1.0, ""learning_rate"": 0.0012178148984621682, ""mlp_dropout"": 0.3990182112985824, ""num_layers"": 2, ""rnn_type"": ""LSTM"", ""synthetic_weight"": 0.1, ""tabular_hidden"": 96, ""weight_decay"": 5.963696676349595e-06}",PRUNED
18,35.361334196679344,2026-09-27 06:05:39.001939,2026-09-27 06:11:46.511291,0 days 00:06:07.509352,64,True,q999,128,1.0,96,20,0.5,0.0011759850889109282,0.12180844304622718,3,0.14337466550235295,LSTM,0.75,64,0.00014021027621985056,"{""batch_size"": 64, ""bidirectional"": true, ""clip_q"": ""q999"", ""fusion_hidden"": 128, ""grad_clip"": 1.0, ""hidden_size"": 96, ""history_steps"": 20, ""huber_beta"": 0.5, ""learning_rate"": 0.0011759850889109282, ""mlp_dropout"": 0.12180844304622718, ""num_layers"": 3, ""rnn_type"": ""LSTM"", ""synthetic_weight"": 0.75, ""tabular_hidden"": 64, ""weight_decay"": 0.00014021027621985056}",COMPLETE
19,39.8812825817674,2026-09-27 06:11:46.721887,2026-09-27 06:19:20.244268,0 days 00:07:33.522381,64,True,q999,64,5.0,96,15,0.5,0.0003854686275398869,0.12316436102196941,3,0.1702101078043837,LSTM,0.75,96,2.897175598518952e-06,"{""batch_size"": 64, ""bidirectional"": true, ""clip_q"": ""q999"", ""fusion_hidden"": 64, ""grad_clip"": 5.0, ""hidden_size"": 96, ""history_steps"": 15, ""huber_beta"": 0.5, ""learning_rate"": 0.0003854686275398869, ""mlp_dropout"": 0.12316436102196941, ""num_layers"": 3, ""rnn_type"": ""LSTM"", ""synthetic_weight"": 0.75, ""tabular_hidden"": 96, ""weight_decay"": 2.897175598518952e-06}",COMPLETE
20,37.05079242044304,2026-09-27 06:19:20.372522,2026-09-27 06:23:07.927850,0 days 00:03:47.555328,64,True,q995,128,1.0,96,20,0.25,0.0011744710901635935,0.2016050106540196,2,0.14884506858429777,LSTM,0.75,128,1.532804521609917e-05,"{""batch_size"": 64, ""bidirectional"": true, ""clip_q"": ""q995"", ""fusion_hidden"": 128, ""grad_clip"": 1.0, ""hidden_size"": 96, ""history_steps"": 20, ""huber_beta"": 0.25, ""learning_rate"": 0.0011744710901635935, ""mlp_dropout"": 0.2016050106540196, ""num_layers"": 2, ""rnn_type"": ""LSTM"", ""synthetic_weight"": 0.75, ""tabular_hidden"": 128, ""weight_decay"": 1.532804521609917e-05}",COMPLETE
21,71.35126709263879,2026-09-27 06:23:08.062127,2026-09-27 06:23:18.271165,0 days 00:00:10.209038,64,True,q999,64,1.0,96,30,1.0,0.0023631629407957788,0.2266080906413156,1,,LSTM,0.0,256,2.7604499905616403e-05,"{""batch_size"": 64, ""bidirectional"": true, ""clip_q"": ""q999"", ""fusion_hidden"": 64, ""grad_clip"": 1.0, ""hidden_size"": 96, ""history_steps"": 30, ""huber_beta"": 1.0, ""learning_rate"": 0.0023631629407957788, ""mlp_dropout"": 0.2266080906413156, ""num_layers"": 1, ""rnn_type"": ""LSTM"", ""synthetic_weight"": 0.0, ""tabular_hidden"": 256, ""weight_decay"": 2.7604499905616403e-05}",PRUNED
22,39.42505713591063,2026-09-27 06:23:18.407812,2026-09-27 06:26:54.009085,0 days 00:03:35.601273,64,False,none,64,1.0,96,15,0.5,0.000840940480598326,0.14796277893401705,3,0.08317431898801214,LSTM,0.75,96,0.00018043539228678645,"{""batch_size"": 64, ""bidirectional"": false, ""clip_q"": ""none"", ""fusion_hidden"": 64, ""grad_clip"": 1.0, ""hidden_size"": 96, ""history_steps"": 15, ""huber_beta"": 0.5, ""learning_rate"": 0.000840940480598326, ""mlp_dropout"": 0.14796277893401705, ""num_layers"": 3, ""rnn_type"": ""LSTM"", ""synthetic_weight"": 0.75, ""tabular_hidden"": 96, ""weight_decay"": 0.00018043539228678645}",COMPLETE
23,34.49675240472997,2026-09-27 06:26:54.175861,2026-09-27 06:32:34.878480,0 days 00:05:40.702619,64,True,q999,96,1.0,128,20,0.5,0.0011672734513414832,0.16402167237741136,3,0.31099120640514466,LSTM,0.75,64,4.18107163378617e-05,"{""batch_size"": 64, ""bidirectional"": true, ""clip_q"": ""q999"", ""fusion_hidden"": 96, ""grad_clip"": 1.0, ""hidden_size"": 128, ""history_steps"": 20, ""huber_beta"": 0.5, ""learning_rate"": 0.0011672734513414832, ""mlp_dropout"": 0.16402167237741136, ""num_layers"": 3, ""rnn_type"": ""LSTM"", ""synthetic_weight"": 0.75, ""tabular_hidden"": 64, ""weight_decay"": 4.18107163378617e-05}",COMPLETE
24,46.03919784111897,2026-09-27 06:32:35.011224,2026-09-27 06:35:08.774396,0 days 00:02:33.763172,64,True,q999,96,1.0,128,20,1.0,0.001909009725424538,0.16929024424617198,3,0.2843113111154486,LSTM,0.1,64,0.0012818237051082171,"{""batch_size"": 64, ""bidirectional"": true, ""clip_q"": ""q999"", ""fusion_hidden"": 96, ""grad_clip"": 1.0, ""hidden_size"": 128, ""history_steps"": 20, ""huber_beta"": 1.0, ""learning_rate"": 0.001909009725424538, ""mlp_dropout"": 0.16929024424617198, ""num_layers"": 3, ""rnn_type"": ""LSTM"", ""synthetic_weight"": 0.1, ""tabular_hidden"": 64, ""weight_decay"": 0.0012818237051082171}",PRUNED
25,36.760525643869876,2026-09-27 06:35:08.905274,2026-09-27 06:41:20.180580,0 days 00:06:11.275306,64,True,q999,128,1.0,64,20,0.5,0.0009997513845240523,0.11305808587695977,3,0.33413415165890314,LSTM,0.75,192,0.0006361160549283814,"{""batch_size"": 64, ""bidirectional"": true, ""clip_q"": ""q999"", ""fusion_hidden"": 128, ""grad_clip"": 1.0, ""hidden_size"": 64, ""history_steps"": 20, ""huber_beta"": 0.5, ""learning_rate"": 0.0009997513845240523, ""mlp_dropout"": 0.11305808587695977, ""num_layers"": 3, ""rnn_type"": ""LSTM"", ""synthetic_weight"": 0.75, ""tabular_hidden"": 192, ""weight_decay"": 0.0006361160549283814}",COMPLETE
26,45.815679298498694,2026-09-27 06:41:20.339640,2026-09-27 06:47:24.574827,0 days 00:06:04.235187,64,True,q999,64,1.0,96,20,0.5,0.000253896590009017,0.1249052553603447,2,0.25276180042670204,LSTM,0.1,96,0.00027746349073022776,"{""batch_size"": 64, ""bidirectional"": true, ""clip_q"": ""q999"", ""fusion_hidden"": 64, ""grad_clip"": 1.0, ""hidden_size"": 96, ""history_steps"": 20, ""huber_beta"": 0.5, ""learning_rate"": 0.000253896590009017, ""mlp_dropout"": 0.1249052553603447, ""num_layers"": 2, ""rnn_type"": ""LSTM"", ""synthetic_weight"": 0.1, ""tabular_hidden"": 96, ""weight_decay"": 0.00027746349073022776}",PRUNED
27,45.52557931055517,2026-09-27 06:47:24.759253,2026-09-27 06:49:27.173339,0 days 00:02:02.414086,256,True,q999,64,1.0,96,20,0.5,0.0011378538086503896,0.15525757758819783,3,0.1843959632956347,LSTM,0.1,64,6.083859384339526e-05,"{""batch_size"": 256, ""bidirectional"": true, ""clip_q"": ""q999"", ""fusion_hidden"": 64, ""grad_clip"": 1.0, ""hidden_size"": 96, ""history_steps"": 20, ""huber_beta"": 0.5, ""learning_rate"": 0.0011378538086503896, ""mlp_dropout"": 0.15525757758819783, ""num_layers"": 3, ""rnn_type"": ""LSTM"", ""synthetic_weight"": 0.1, ""tabular_hidden"": 64, ""weight_decay"": 6.083859384339526e-05}",PRUNED
28,37.0012503230431,2026-09-27 06:49:27.361155,2026-09-27 06:55:52.928475,0 days 00:06:25.567320,64,True,q999,96,5.0,128,20,0.5,0.000645086763957582,0.13187459281597702,3,0.11824003696375504,LSTM,0.75,256,5.215446035514544e-05,"{""batch_size"": 64, ""bidirectional"": true, ""clip_q"": ""q999"", ""fusion_hidden"": 96, ""grad_clip"": 5.0, ""hidden_size"": 128, ""history_steps"": 20, ""huber_beta"": 0.5, ""learning_rate"": 0.000645086763957582, ""mlp_dropout"": 0.13187459281597702, ""num_layers"": 3, ""rnn_type"": ""LSTM"", ""synthetic_weight"": 0.75, ""tabular_hidden"": 256, ""weight_decay"": 5.215446035514544e-05}",COMPLETE
29,37.623811112425265,2026-09-27 06:55:53.082060,2026-09-27 06:58:22.064096,0 days 00:02:28.982036,192,True,q999,96,1.0,128,20,0.5,0.0006858344775330205,0.21403535850965222,3,0.0371407892776303,LSTM,0.75,64,1.1202091823709534e-05,"{""batch_size"": 192, ""bidirectional"": true, ""clip_q"": ""q999"", ""fusion_hidden"": 96, ""grad_clip"": 1.0, ""hidden_size"": 128, ""history_steps"": 20, ""huber_beta"": 0.5, ""learning_rate"": 0.0006858344775330205, ""mlp_dropout"": 0.21403535850965222, ""num_layers"": 3, ""rnn_type"": ""LSTM"", ""synthetic_weight"": 0.75, ""tabular_hidden"": 64, ""weight_decay"": 1.1202091823709534e-05}",COMPLETE
