number,value,datetime_start,datetime_complete,duration,params_batch_size,params_bidirectional,params_clip_q,params_fusion_hidden,params_grad_clip,params_hidden_size,params_history_steps,params_huber_beta,params_learning_rate,params_mlp_dropout,params_num_layers,params_rnn_dropout,params_rnn_type,params_synthetic_weight,params_tabular_hidden,params_weight_decay,system_attrs_tpe:relative_params:0,state
0,32.42368791446666,2026-09-27 02:07:06.923172,2026-09-27 02:16:08.885522,0 days 00:09:01.962350,64,True,q999,64,1.0,96,20,0.5,0.0008229421352700022,0.12630777354553704,3,0.24371820172525102,LSTM,0.75,96,6.0523233100781254e-05,,COMPLETE
1,47.778554609811685,2026-09-27 02:16:09.237326,2026-09-27 02:20:46.643257,0 days 00:04:37.405931,64,False,q999,128,2.0,32,20,0.25,0.0003603498355153184,0.08026102244753223,1,,LSTM,0.25,192,0.0015038271491457477,,COMPLETE
2,75.19313158503992,2026-09-27 02:20:46.966743,2026-09-27 02:21:07.865147,0 days 00:00:20.898404,128,False,none,192,0.5,64,15,1.0,0.0009381645298896862,0.22308689357169043,3,0.2213747861383773,GRU,0.0,96,0.006718390446089726,,COMPLETE
3,53.01331355063264,2026-09-27 02:21:08.177137,2026-09-27 02:27:38.791082,0 days 00:06:30.613945,64,False,none,96,2.0,32,20,1.0,0.00012421733228319676,0.09739390506264511,2,0.22649172042811574,LSTM,0.1,192,0.0001264936003269507,,COMPLETE
4,75.95693797745815,2026-09-27 02:27:39.034186,2026-09-27 02:27:57.111940,0 days 00:00:18.077754,256,True,q995,96,5.0,32,10,0.5,0.00046926239163901096,0.42845247742639964,2,0.09656845360928862,GRU,0.0,128,5.116819219852885e-06,,COMPLETE
5,41.578434072091916,2026-09-27 02:27:57.375968,2026-09-27 02:29:50.253539,0 days 00:01:52.877571,192,False,q999,192,1.0,48,15,1.0,0.0008144571295603401,0.2374622810280732,2,0.08444756241288043,LSTM,0.5,192,0.00021870901732297512,,COMPLETE
6,43.78094492204561,2026-09-27 02:29:50.523527,2026-09-27 02:46:24.593756,0 days 00:16:34.070229,128,True,none,96,0.5,48,20,0.25,0.00023807498862760706,0.25991700909544174,3,0.34854803124425826,GRU,1.0,64,0.014300413056654434,,COMPLETE
7,40.790809511077384,2026-09-27 02:46:24.786483,2026-09-27 02:52:16.693368,0 days 00:05:51.906885,64,True,q995,192,2.0,96,15,0.25,0.0007409419004418181,0.31392784686172276,1,,LSTM,0.25,64,0.021732544561887154,,COMPLETE
8,51.64783348500963,2026-09-27 02:52:16.907998,2026-09-27 02:55:28.764222,0 days 00:03:11.856224,128,False,q999,64,5.0,64,15,0.25,0.00011590691871290111,0.35798310914854986,3,0.16384000052881564,LSTM,1.0,64,0.0001578719425714864,,PRUNED
9,50.27601742036543,2026-09-27 02:55:28.931492,2026-09-27 02:57:11.727778,0 days 00:01:42.796286,192,False,q995,192,0.5,64,10,0.25,0.00022394973042252905,0.1454007345708969,1,,LSTM,0.5,64,0.0025035783231522287,,PRUNED
10,34.99347744540152,2026-09-27 02:57:11.956957,2026-09-27 03:05:15.907660,0 days 00:08:03.950703,64,True,q999,64,1.0,128,20,0.5,0.0006184067284511305,0.28288491606179705,3,0.3934881414895832,LSTM,0.25,192,3.1233408857425347e-06,"{""batch_size"": 64, ""bidirectional"": true, ""clip_q"": ""q999"", ""fusion_hidden"": 64, ""grad_clip"": 1.0, ""hidden_size"": 128, ""history_steps"": 20, ""huber_beta"": 0.5, ""learning_rate"": 0.0006184067284511305, ""mlp_dropout"": 0.28288491606179705, ""num_layers"": 3, ""rnn_type"": ""LSTM"", ""synthetic_weight"": 0.25, ""tabular_hidden"": 192, ""weight_decay"": 3.1233408857425347e-06}",COMPLETE
11,34.106114594942106,2026-09-27 03:05:16.072234,2026-09-27 03:12:09.063359,0 days 00:06:52.991125,64,True,q999,64,1.0,96,20,1.0,0.0025460081136878996,0.27613042209269434,2,0.39726240610790264,LSTM,0.75,256,3.812216172637749e-05,"{""batch_size"": 64, ""bidirectional"": true, ""clip_q"": ""q999"", ""fusion_hidden"": 64, ""grad_clip"": 1.0, ""hidden_size"": 96, ""history_steps"": 20, ""huber_beta"": 1.0, ""learning_rate"": 0.0025460081136878996, ""mlp_dropout"": 0.27613042209269434, ""num_layers"": 2, ""rnn_type"": ""LSTM"", ""synthetic_weight"": 0.75, ""tabular_hidden"": 256, ""weight_decay"": 3.812216172637749e-05}",COMPLETE
12,35.33411482025217,2026-09-27 03:12:09.248436,2026-09-27 03:14:39.195773,0 days 00:02:29.947337,256,True,q999,64,1.0,96,20,0.5,0.0006707586430164437,0.15821277382701304,2,0.30500000154985085,LSTM,0.75,96,0.0002041338137543972,"{""batch_size"": 256, ""bidirectional"": true, ""clip_q"": ""q999"", ""fusion_hidden"": 64, ""grad_clip"": 1.0, ""hidden_size"": 96, ""history_steps"": 20, ""huber_beta"": 0.5, ""learning_rate"": 0.0006707586430164437, ""mlp_dropout"": 0.15821277382701304, ""num_layers"": 2, ""rnn_type"": ""LSTM"", ""synthetic_weight"": 0.75, ""tabular_hidden"": 96, ""weight_decay"": 0.0002041338137543972}",COMPLETE
13,36.90506365216188,2026-09-27 03:14:39.371952,2026-09-27 03:21:19.111845,0 days 00:06:39.739893,64,True,q999,64,1.0,96,20,1.0,0.00039435863696626097,0.20176471994638445,1,,LSTM,0.75,256,5.923987007450404e-06,"{""batch_size"": 64, ""bidirectional"": true, ""clip_q"": ""q999"", ""fusion_hidden"": 64, ""grad_clip"": 1.0, ""hidden_size"": 96, ""history_steps"": 20, ""huber_beta"": 1.0, ""learning_rate"": 0.00039435863696626097, ""mlp_dropout"": 0.20176471994638445, ""num_layers"": 1, ""rnn_type"": ""LSTM"", ""synthetic_weight"": 0.75, ""tabular_hidden"": 256, ""weight_decay"": 5.923987007450404e-06}",COMPLETE
14,68.67661324368297,2026-09-27 03:21:19.228899,2026-09-27 03:21:54.377940,0 days 00:00:35.149041,64,True,q999,64,1.0,96,20,1.0,0.0017464020245688036,0.2782636573228457,3,0.0033479867593315116,GRU,0.0,256,9.082333954165045e-05,"{""batch_size"": 64, ""bidirectional"": true, ""clip_q"": ""q999"", ""fusion_hidden"": 64, ""grad_clip"": 1.0, ""hidden_size"": 96, ""history_steps"": 20, ""huber_beta"": 1.0, ""learning_rate"": 0.0017464020245688036, ""mlp_dropout"": 0.2782636573228457, ""num_layers"": 3, ""rnn_type"": ""GRU"", ""synthetic_weight"": 0.0, ""tabular_hidden"": 256, ""weight_decay"": 9.082333954165045e-05}",PRUNED
15,44.715440683077524,2026-09-27 03:21:54.506367,2026-09-27 03:28:45.878509,0 days 00:06:51.372142,64,True,q999,64,1.0,64,20,1.0,0.002639905412315597,0.39150354893479167,2,0.2881898397025523,LSTM,0.1,256,0.0001964882858949571,"{""batch_size"": 64, ""bidirectional"": true, ""clip_q"": ""q999"", ""fusion_hidden"": 64, ""grad_clip"": 1.0, ""hidden_size"": 64, ""history_steps"": 20, ""huber_beta"": 1.0, ""learning_rate"": 0.002639905412315597, ""mlp_dropout"": 0.39150354893479167, ""num_layers"": 2, ""rnn_type"": ""LSTM"", ""synthetic_weight"": 0.1, ""tabular_hidden"": 256, ""weight_decay"": 0.0001964882858949571}",COMPLETE
16,35.93559199697845,2026-09-27 03:28:46.046666,2026-09-27 03:34:00.542599,0 days 00:05:14.495933,64,True,q999,64,1.0,96,30,0.25,0.002135215477956219,0.0891575890123906,2,0.24662583418647038,LSTM,0.75,256,3.3062183810238734e-05,"{""batch_size"": 64, ""bidirectional"": true, ""clip_q"": ""q999"", ""fusion_hidden"": 64, ""grad_clip"": 1.0, ""hidden_size"": 96, ""history_steps"": 30, ""huber_beta"": 0.25, ""learning_rate"": 0.002135215477956219, ""mlp_dropout"": 0.0891575890123906, ""num_layers"": 2, ""rnn_type"": ""LSTM"", ""synthetic_weight"": 0.75, ""tabular_hidden"": 256, ""weight_decay"": 3.3062183810238734e-05}",COMPLETE
17,43.304131706504926,2026-09-27 03:34:00.706251,2026-09-27 03:40:33.601122,0 days 00:06:32.894871,96,True,q999,128,1.0,96,20,1.0,0.0012178148984621682,0.3990182112985824,2,0.39390784182842725,LSTM,0.1,96,5.963696676349595e-06,"{""batch_size"": 96, ""bidirectional"": true, ""clip_q"": ""q999"", ""fusion_hidden"": 128, ""grad_clip"": 1.0, ""hidden_size"": 96, ""history_steps"": 20, ""huber_beta"": 1.0, ""learning_rate"": 0.0012178148984621682, ""mlp_dropout"": 0.3990182112985824, ""num_layers"": 2, ""rnn_type"": ""LSTM"", ""synthetic_weight"": 0.1, ""tabular_hidden"": 96, ""weight_decay"": 5.963696676349595e-06}",COMPLETE
18,31.657776831734832,2026-09-27 03:40:33.964238,2026-09-27 03:47:44.294489,0 days 00:07:10.330251,64,True,q999,128,1.0,96,20,0.5,0.0011759850889109282,0.12180844304622718,3,0.14337466550235295,LSTM,0.75,64,0.00014021027621985056,"{""batch_size"": 64, ""bidirectional"": true, ""clip_q"": ""q999"", ""fusion_hidden"": 128, ""grad_clip"": 1.0, ""hidden_size"": 96, ""history_steps"": 20, ""huber_beta"": 0.5, ""learning_rate"": 0.0011759850889109282, ""mlp_dropout"": 0.12180844304622718, ""num_layers"": 3, ""rnn_type"": ""LSTM"", ""synthetic_weight"": 0.75, ""tabular_hidden"": 64, ""weight_decay"": 0.00014021027621985056}",COMPLETE
19,37.03538600954516,2026-09-27 03:47:44.420273,2026-09-27 03:56:04.226230,0 days 00:08:19.805957,64,True,q999,64,5.0,96,15,0.5,0.0003854686275398869,0.12316436102196941,3,0.1702101078043837,LSTM,0.75,96,2.897175598518952e-06,"{""batch_size"": 64, ""bidirectional"": true, ""clip_q"": ""q999"", ""fusion_hidden"": 64, ""grad_clip"": 5.0, ""hidden_size"": 96, ""history_steps"": 15, ""huber_beta"": 0.5, ""learning_rate"": 0.0003854686275398869, ""mlp_dropout"": 0.12316436102196941, ""num_layers"": 3, ""rnn_type"": ""LSTM"", ""synthetic_weight"": 0.75, ""tabular_hidden"": 96, ""weight_decay"": 2.897175598518952e-06}",COMPLETE
20,33.00855476259758,2026-09-27 03:56:04.449817,2026-09-27 04:02:47.529583,0 days 00:06:43.079766,64,True,q995,128,1.0,96,20,0.25,0.0011744710901635935,0.2016050106540196,2,0.14884506858429777,LSTM,0.75,128,1.532804521609917e-05,"{""batch_size"": 64, ""bidirectional"": true, ""clip_q"": ""q995"", ""fusion_hidden"": 128, ""grad_clip"": 1.0, ""hidden_size"": 96, ""history_steps"": 20, ""huber_beta"": 0.25, ""learning_rate"": 0.0011744710901635935, ""mlp_dropout"": 0.2016050106540196, ""num_layers"": 2, ""rnn_type"": ""LSTM"", ""synthetic_weight"": 0.75, ""tabular_hidden"": 128, ""weight_decay"": 1.532804521609917e-05}",COMPLETE
21,32.281767574851166,2026-09-27 04:02:47.724807,2026-09-27 04:10:05.367358,0 days 00:07:17.642551,64,True,q999,96,1.0,96,30,0.5,0.0008847018291721974,0.12182623809205263,3,0.1398303198273714,LSTM,0.75,192,9.02364585547729e-05,"{""batch_size"": 64, ""bidirectional"": true, ""clip_q"": ""q999"", ""fusion_hidden"": 96, ""grad_clip"": 1.0, ""hidden_size"": 96, ""history_steps"": 30, ""huber_beta"": 0.5, ""learning_rate"": 0.0008847018291721974, ""mlp_dropout"": 0.12182623809205263, ""num_layers"": 3, ""rnn_type"": ""LSTM"", ""synthetic_weight"": 0.75, ""tabular_hidden"": 192, ""weight_decay"": 9.02364585547729e-05}",COMPLETE
22,32.513283181065056,2026-09-27 04:10:05.496261,2026-09-27 04:15:42.262668,0 days 00:05:36.766407,64,True,none,128,1.0,96,20,0.5,0.0009239029749245551,0.1170802105285654,3,0.05336349311572078,LSTM,0.75,64,7.48888640655572e-05,"{""batch_size"": 64, ""bidirectional"": true, ""clip_q"": ""none"", ""fusion_hidden"": 128, ""grad_clip"": 1.0, ""hidden_size"": 96, ""history_steps"": 20, ""huber_beta"": 0.5, ""learning_rate"": 0.0009239029749245551, ""mlp_dropout"": 0.1170802105285654, ""num_layers"": 3, ""rnn_type"": ""LSTM"", ""synthetic_weight"": 0.75, ""tabular_hidden"": 64, ""weight_decay"": 7.48888640655572e-05}",COMPLETE
23,32.388002742489,2026-09-27 04:15:42.416566,2026-09-27 04:19:38.228921,0 days 00:03:55.812355,96,True,q999,96,1.0,48,30,0.5,0.0009561234268133749,0.17757150524178233,3,0.11245672266535685,LSTM,0.75,192,0.0014528831225177395,"{""batch_size"": 96, ""bidirectional"": true, ""clip_q"": ""q999"", ""fusion_hidden"": 96, ""grad_clip"": 1.0, ""hidden_size"": 48, ""history_steps"": 30, ""huber_beta"": 0.5, ""learning_rate"": 0.0009561234268133749, ""mlp_dropout"": 0.17757150524178233, ""num_layers"": 3, ""rnn_type"": ""LSTM"", ""synthetic_weight"": 0.75, ""tabular_hidden"": 192, ""weight_decay"": 0.0014528831225177395}",COMPLETE
24,33.05291613793102,2026-09-27 04:19:38.431844,2026-09-27 04:24:18.346218,0 days 00:04:39.914374,64,True,q999,128,1.0,96,20,0.5,0.0014620953908750462,0.15246841672357825,3,0.11876744826589763,LSTM,0.75,96,0.0005259975965351347,"{""batch_size"": 64, ""bidirectional"": true, ""clip_q"": ""q999"", ""fusion_hidden"": 128, ""grad_clip"": 1.0, ""hidden_size"": 96, ""history_steps"": 20, ""huber_beta"": 0.5, ""learning_rate"": 0.0014620953908750462, ""mlp_dropout"": 0.15246841672357825, ""num_layers"": 3, ""rnn_type"": ""LSTM"", ""synthetic_weight"": 0.75, ""tabular_hidden"": 96, ""weight_decay"": 0.0005259975965351347}",COMPLETE
25,32.523662372527916,2026-09-27 04:24:18.466093,2026-09-27 04:26:19.342462,0 days 00:02:00.876369,256,True,q999,96,1.0,96,30,0.5,0.0007717258694985514,0.24948704563927832,3,0.18848713248736404,LSTM,0.75,128,2.0334175385222007e-05,"{""batch_size"": 256, ""bidirectional"": true, ""clip_q"": ""q999"", ""fusion_hidden"": 96, ""grad_clip"": 1.0, ""hidden_size"": 96, ""history_steps"": 30, ""huber_beta"": 0.5, ""learning_rate"": 0.0007717258694985514, ""mlp_dropout"": 0.24948704563927832, ""num_layers"": 3, ""rnn_type"": ""LSTM"", ""synthetic_weight"": 0.75, ""tabular_hidden"": 128, ""weight_decay"": 2.0334175385222007e-05}",COMPLETE
26,32.68108213593698,2026-09-27 04:26:19.493077,2026-09-27 04:30:25.901999,0 days 00:04:06.408922,96,True,q999,96,0.5,48,30,0.5,0.0016671016382050954,0.20184528225744983,3,0.052207169948400925,LSTM,0.75,192,0.020020905196076764,"{""batch_size"": 96, ""bidirectional"": true, ""clip_q"": ""q999"", ""fusion_hidden"": 96, ""grad_clip"": 0.5, ""hidden_size"": 48, ""history_steps"": 30, ""huber_beta"": 0.5, ""learning_rate"": 0.0016671016382050954, ""mlp_dropout"": 0.20184528225744983, ""num_layers"": 3, ""rnn_type"": ""LSTM"", ""synthetic_weight"": 0.75, ""tabular_hidden"": 192, ""weight_decay"": 0.020020905196076764}",COMPLETE
27,40.87042627158988,2026-09-27 04:30:26.079607,2026-09-27 04:33:05.952189,0 days 00:02:39.872582,96,True,q999,96,1.0,48,15,0.5,0.000396660935058333,0.21606465351656753,3,0.12405415623885054,LSTM,0.75,192,0.0008768164927189883,"{""batch_size"": 96, ""bidirectional"": true, ""clip_q"": ""q999"", ""fusion_hidden"": 96, ""grad_clip"": 1.0, ""hidden_size"": 48, ""history_steps"": 15, ""huber_beta"": 0.5, ""learning_rate"": 0.000396660935058333, ""mlp_dropout"": 0.21606465351656753, ""num_layers"": 3, ""rnn_type"": ""LSTM"", ""synthetic_weight"": 0.75, ""tabular_hidden"": 192, ""weight_decay"": 0.0008768164927189883}",PRUNED
28,39.608545627625624,2026-09-27 04:33:06.083779,2026-09-27 04:35:44.930968,0 days 00:02:38.847189,96,True,q999,96,5.0,48,30,0.5,0.0006145236053672694,0.0507410509865063,3,0.19175172679092334,LSTM,0.75,192,0.0012726668495494336,"{""batch_size"": 96, ""bidirectional"": true, ""clip_q"": ""q999"", ""fusion_hidden"": 96, ""grad_clip"": 5.0, ""hidden_size"": 48, ""history_steps"": 30, ""huber_beta"": 0.5, ""learning_rate"": 0.0006145236053672694, ""mlp_dropout"": 0.0507410509865063, ""num_layers"": 3, ""rnn_type"": ""LSTM"", ""synthetic_weight"": 0.75, ""tabular_hidden"": 192, ""weight_decay"": 0.0012726668495494336}",PRUNED
29,32.316217012390396,2026-09-27 04:35:45.069298,2026-09-27 04:40:40.348360,0 days 00:04:55.279062,96,True,q999,96,2.0,64,30,0.5,0.0017512390618419104,0.16778960004495788,3,0.06845624652875798,LSTM,0.75,192,0.001131007198660719,"{""batch_size"": 96, ""bidirectional"": true, ""clip_q"": ""q999"", ""fusion_hidden"": 96, ""grad_clip"": 2.0, ""hidden_size"": 64, ""history_steps"": 30, ""huber_beta"": 0.5, ""learning_rate"": 0.0017512390618419104, ""mlp_dropout"": 0.16778960004495788, ""num_layers"": 3, ""rnn_type"": ""LSTM"", ""synthetic_weight"": 0.75, ""tabular_hidden"": 192, ""weight_decay"": 0.001131007198660719}",COMPLETE
